npsn,nama_sekolah,akreditasi,alamat,kelurahan,kecamatan
20111819,TK Angkasa 3,A,Jl. Mustang No 1 komp Skadron,Halim Perdana Kusumah,Makasar
20111820,TK Angkasa 4,A,Jl. Suhadi,Halim Perdana Kusumah,Makasar
20111821,TK Angkasa 5,A,Jl. Angkasa I No. 109,Halim Perdana Kusumah,Makasar
20111822,TK Angkasa 6,B,Jl. Permadi Dirgantara I,Halim Perdana Kusumah,Makasar
20111823,TK Angkasa 7,A,Jl. Banowati,Halim Perdana Kusumah,Makasar
20111824,TK Angkasa 8,A,Jl. Raya Pondok Gede,Halim Perdana Kusumah,Makasar
20111825,TK Angkasa I,A,Jl. Rajawali Raya,Halim Perdana Kusumah,Makasar
20111826,TK Anindia,Tidak Terakreditasi,Jl. Pisangan Baru I No. 28,Pisangan Baru,Matraman
,TK An-Nahl,Tidak Terakreditasi,Jl. KH. Abdul Hamid No. 28 Rt. 002/03,Duri Kosambi,Cengkareng
20110595,TK An-Najmul Ilmu,B,Jl. Satria III No. 2,Pademangan Barat,Pademangan
69830972,TK An-Ni'mah,Tidak Terakreditasi,Jalan rawajati Timur I No.5,Rawajati,Pancoran
20110878,TK Annisa,Tidak Terakreditasi,Jl. Peta Barat No.41,Kalideres,Kalideres
20111814,TK ANNUR,A,JL JERUK II NO.12-14,Rawamangun,Pulo Gadung
20110879,TK Annuriyah,Tidak Terakreditasi,Jl. H.Sa'aba Komp.Unilever Blok A1 No. 20,Meruya Selatan,Kembangan
20109638,TK An-Nursiyah,B,Jl. Galur Sari Raya No. 19 A,Utan Kayu Selatan,Matraman
20109632,TK Antonius,A,Jl. Matraman Raya 119,Pal Meriem,Matraman
20110880,TK Anugerah,B,Jl. Kapuk Raya,Kapuk,Cengkareng
20110881,TK Anugrah Montessori,Tidak Terakreditasi,Jl. Idris Sukabumi Utara,Sukabumi Utara,Kebon Jeruk
20110243,TK Anyelir,Tidak Terakreditasi,Jl. H. Baping Gg. Pertiwi,Susukan,Ciracas
20110597,TK Aple Tree Pre-School,Tidak Terakreditasi,Jl. Muara Karang I 1 Selatan No.26,Pluit,Penjaringan
,TK Ar Rafiqiah,Tidak Terakreditasi,Cakung Barat Rt. 01/05,Cakung Barat,Cakung
,TK Ar Rahmah,Tidak Terakreditasi,Jl. H. Tohir No. 22,Lenteng Agung,Jagakarsa
20110301,TK Ar Rahmah,A,Jl. SMA Negeri 48,Pinang Ranti,Makasar
69728740,TK Ar Rahmah,Tidak Terakreditasi,Jl. H. ridi,Ulujami,Pesanggrahan
20110883,TK Ar Rahman,Tidak Terakreditasi,Jl. Anggrek Cendrawasih Blok Y,Kemanggisan,Palmerah
20111829,TK Ar Rahman,Tidak Terakreditasi,Jl. Tengki No. 11,Cipayung,Cipayung
20178128,TK Ar Rahman,Tidak Terakreditasi,Jl. Durian Raya No. 5,Jagakarsa,Jagakarsa
20111384,TK Ar Rahman Motik,A,Jl. Setiabudi Utara Blok D1,Setia Budi,Setia Budi
20110884,TK Ar Rahmat,Tidak Terakreditasi,Jl. Pepaya II/10,Cengkareng Barat,Cengkareng
20110598,TK Ar Raudhah,C,Jl. Cemara Gg. III Blok I No. 90,Lagoa,K o j a
20110291,TK Ar Ridho,Tidak Terakreditasi,Komplek Pulogebang Permai Blok J1 No.3,Pulo Gebang,Cakung
20110861,TK Ar Ridho,A,Jl. Kota Bambu Utara 04/05,Kota Bambu Utara,Palmerah
20111830,TK Ar Rini,B,Jl. Raya Pondok Gede No. 24,Pinang Ranti,Makasar
,TK Ar Rodhiyah,Tidak Terakreditasi,Jl. Warung Gantung Kp. Kojan,Kalideres,Kalideres
20109590,TK Arafah,B,Jl. Raya Cilangkap No. 3,Cilangkap,Cipayung
20109588,TK Arfanda,Tidak Terakreditasi,Jl. Buni No. 85,Munjul,Cipayung
20109957,TK Arimbi,Tidak Terakreditasi,Jl. Pedati Utara No. 5,Cijantung,Pasar Rebo
20111385,TK Arimbi,Tidak Terakreditasi,Jl. Seno II,Pejaten Timur,Pasar Minggu
20109869,TK Ar-rahmah,Tidak Terakreditasi,Jl. Kelapa Dua Wetan,Kelapa Dua Wetan,Ciracas
20111831,TK Ar-Rahmah,Tidak Terakreditasi,Jl. Raya Bogor Km.26 No. 2A,Cijantung,Pasar Rebo
,TK Ar-Rahman,Tidak Terakreditasi,Jl. H. Damong Ciganjur,Cipedak,Jagakarsa
20111832,TK Ar-Ridwan,B,Jl. Raya Bogor,Pekayon,Pasar Rebo
20110886,TK Arrifdah,Tidak Terakreditasi,Jl. A. Duri Tol Duri Kepa,Duri Kepa,Kebon Jeruk
20111386,TK Arti,B,Jl. Petogogan I Gg. V No. 57,Gandaria Utara,Kebayoran Baru
20110599,TK Arundina,B,Jl. H. Oyar Rt 02/04 No. 50,Pegangsaan Dua,Kelapa Gading
20111722,TK As Saadah,Tidak Terakreditasi,Jl. Raya Condet,Cililitan,Kramat Jati
20110887,TK As Saaidiyyah,Tidak Terakreditasi,Jl. Peta Barat No. 3 Rt. 05/07,Kalideres,Kalideres
20110889,TK As Salam,A,Jl. Masjid As Salam Komp. DKI Joglo,Joglo,Kembangan
20110891,TK As Sholihat,Tidak Terakreditasi,Jl. Gaga No. 83,Semanan,Kalideres
20110892,TK As Sidiqin,Tidak Terakreditasi,Jl. Kayu Besar,Tegal Alur,Kalideres
20111723,TK Asah Pra Sekolah,C,Jl. Dukuh V Rt. 9/05,Dukuh,Kramat Jati
20178116,TK Ash Sholihah,Tidak Terakreditasi,Jl. Moch Kaffi II gg. Sirsak No. 17,Jagakarsa,Jagakarsa
,TK Ash. Sholihin,Tidak Terakreditasi,Jl. KH. Thohir Kamp. Baru No.6,Sukabumi Selatan,Kebon Jeruk
20111387,TK Asiah,Tidak Terakreditasi,Jl. Kemandoran VII,Grogol Utara,Kebayoran Lama
,TK Asih,B,Jl. Tridharma Raya No. 11,Pondok Labu,Cilandak
20110893,TK Asih Mulia,Tidak Terakreditasi,Jl. Prepedan No. 55,Kamal,Kalideres
20110894,TK Asiyiyah 2,B,Jl. Dr. Susilo I,Grogol,Grogol Petamburan
20110293,TK Asri,A,Jl. Asri No. 41,Halim Perdana Kusumah,Makasar
20110601,TK Asri Cilincing,Tidak Terakreditasi,Jl. Baru Gg. Dua,Cilincing,Cilincing
20111836,TK Assa`adah,A,Jl. Swakarsa IB No. 40,Pondok Kelapa,Duren Sawit
20109870,TK Assa'adiyah Attahiriyah,B,Jl. Raya Ciracas No. 7,Ciracas,Ciracas
20111388,TK Assakinah,Tidak Terakreditasi,Jl. Bendi Utama No. 22 Tanah Kusir,Kebayoran Lama Utara,Kebayoran Lama
69830958,TK Asshabiriin,B,Jl. Mampang Prapatan XIV No. 55,Tegal Parang,Mampang Prapatan
,TK Assyifa Djohar,Tidak Terakreditasi,Jl. Isa No. 71 Rt. 009/003,Sukabumi Utara,Kebon Jeruk
,TK As'Syukuria,Tidak Terakreditasi,Jl. Baung II No. 19,Kebagusan,Pasar Minggu
,TK Asy Syifa hanum,Tidak Terakreditasi,Jln. Tebet Timur Dalam No. 95 C,Tebet Timur,T e b e t
,TK Asyifah,Tidak Terakreditasi,Jl. Kebembem Raya III No. 76,Jagakarsa,Jagakarsa
20111391,TK At Atfal II,C,Jl. Sabar Gg. Lahab No. 83,Petukangan Selatan,Pesanggrahan
20110896,TK At Tahriyah,B,Jl. Peta Utara No. 67,Pegadungan,Kalideres
20110385,TK At Taqwa,A,Jl. Rajawali Selatan VI No.18,Gunung Sahari Utara,Sawah Besar
20110603,TK At Taqwa,Tidak Terakreditasi,Jl. Dukuh Utara,Semper Barat,Cilincing
20111392,TK At Taqwa,Tidak Terakreditasi,Jl. Swadarma Raya Kampung Baru No. 25,Ulujami,Pesanggrahan
20110604,TK At Taubah,Tidak Terakreditasi,Jl. Mangga No. 12,Lagoa,K o j a
20111393,TK At Taubah,Tidak Terakreditasi,Jl. Pancoran Barat VIII No. 10,Pancoran,Pancoran
20111841,TK At Taubah,B,Jl. Pulo Mas II,Kayu Putih,Pulo Gadung
,TK Athallah,Tidak Terakreditasi,Jl. Kemajuan No. 89,Petukangan Selatan,Pesanggrahan
,TK Athallah Mursyid,Tidak Terakreditasi,Jl. Teknologi I Blok II 16/B24,Meruya Utara,Kembangan
20111394,TK Attahiriyah,Tidak Terakreditasi,Jl. KH. Abdullah Syafi`i No. 68,Bukit Duri,T e b e t
,TK Aulia,Tidak Terakreditasi,Jl. Pedongkelan Belakang,Kapuk,Cengkareng
,TK Aulia,Tidak Terakreditasi,Jl. Sawo Kelapa Dua No.10,Kelapa Dua,Kebon Jeruk
20110162,TK Aulia,Tidak Terakreditasi,Jl. Cibubur VII,Cibubur,Ciracas
20111395,TK Aulia,C,Jl. Swadaya II No. 21A,Tanjung Barat,Jagakarsa
20111396,TK Aulia,A,Jl. H. Salim No.21A,Bintaro,Pesanggrahan
,TK Avicenna,A,Jl. Moch. Kahfi II No. 66,Cipedak,Jagakarsa
,TK Ayah Bunda,B,"Jl. Muara Bahari, Ancol Selatan",Sunter Agung,Tanjung Priok
20109644,TK Ayu Andika,Tidak Terakreditasi,Jl. Pramuka Jaya VI/1,Utan Kayu Utara,Matraman
69790666,TK Az - Zahroh,Tidak Terakreditasi,Jl. Duri Bangkit No. 25 Rt. 06/09,Jembatan Besi,Tambora
20111397,TK Az Azahra,A,Jl. Sabar NO 26,Petukangan Selatan,Pesanggrahan
,TK Azhari Islamic School,Tidak Terakreditasi,Jl. Pertanian Raya No. 43,Lebak Bulus,Cilandak
20111844,TK Az-Zuhdiyah,B,Jl. Masjid Al-Thayibah Km. 21,Pulo Gadung,Pulo Gadung
20112265,TK Babul Ilmi,Tidak Terakreditasi,Jl. Jembatan III No. 32,Balekambang,Kramat Jati
20111398,TK Bachtera Trisna,A,Jl. Ragunan Komp. Bea Cukai.,Pasar Minggu,Pasar Minggu
69857067,TK BAGAS,Tidak Terakreditasi,,,
20110608,TK Bahagia,Tidak Terakreditasi,Jl. Pluit Selatan I No. 1,Pluit,Penjaringan
20110609,TK Bahagia,A,Jl. Sunter Mas Barat Blok H 12/5,Sunter Jaya,Tanjung Priok
69830832,TK Bahari,B,Jl. Bahari I No. 1,Gandaria Selatan,Cilandak
20110031,TK Bahtera Ceria,Tidak Terakreditasi,Jl. Bojana Tirta Balai Rw. 015 Komp. Bea dan Cukai,Pisangan Timur,Pulo Gadung
20111848,TK Bahtera Cipta,Tidak Terakreditasi,Jl. K. Belawan No. 31 Bea Cukai,Pondok Bambu,Duren Sawit
20110610,TK Bahtera Kencana Indah,B,Jl. Warakas VII No:15,Warakas,Tanjung Priok
20110898,TK Bai'aturidwan,Tidak Terakreditasi,Jl. Prepedan Raya No. 53,Kamal,Kalideres
,TK Bait Qur'any An-Nur,Tidak Terakreditasi,Jl. Kalipasir No. 19,Kebon Sirih,Menteng
20109595,TK Baitul Ilmi,Tidak Terakreditasi,Jl. Ali No. 21,Cipayung,Cipayung
20110611,TK Baitul Ma'mur,B,Jl. Raya Pelabuhan V/ 12,Koja,K o j a
20110294,TK Baitul Rahim,B,Jl. Kp. Pulo,Pinang Ranti,Makasar
20177847,TK Baitul Uyun,Tidak Terakreditasi,Jl. Kapuk Budi Karya No. 64,Kapuk,Cengkareng
20110613,TK Baiturrahman,Tidak Terakreditasi,Jl. Green Garden Blok B16 No. 21,Rorotan,Cilincing
20110899,TK Baiturrahman,Tidak Terakreditasi,Jl. Perintis Gombol Raya,Kalideres,Kalideres
20111401,TK Baiturrahman,B,Jl. Duren Tiga Selatan VII,Duren Tiga,Pancoran
69785845,TK Baiturrahman,Tidak Terakreditasi,Jl. Cerucuk No. 19,Bukit Duri,T e b e t
20110901,TK Baiturrahman Citra,Tidak Terakreditasi,Jl. Citra I Blok C-16/17,Kalideres,Kalideres
20111402,TK Baitus Salam,A,Jl. Palapa .,Pasar Minggu,Pasar Minggu
20111403,TK Bakti Arum,Tidak Terakreditasi,Jl. Duku No 49C,Pesanggrahan,Pesanggrahan
20111404,TK Bakti Ibu,B,Jl. Suryo No. 35,Rawa Barat,Kebayoran Baru
20111405,TK Bakti Mulya 400,A,Jl. Gedung Pinang,Pondok Pinang,Kebayoran Lama
20110614,TK Bakti Siwi,C,Komp. depkes sunter jl. instalkes blok c3 no. 10,Sunter Jaya,Tanjung Priok
20111853,TK Bakti Utama,B,Jl. Damai,Pulo Gebang,Cakung
20111406,TK Bakti V,A,Jl. Jamrud II,Cilandak Barat,Cilandak
20110902,TK Bala Keselamatan,B,Jl. Mangga Besar Raya No. 39,Tangki,Taman Sari
,TK Balekambang,Tidak Terakreditasi,Jl. Mesjid Al-Mabruk Rt. 0012/03,Balekambang,Kramat Jati
20109625,TK Bamadita Rahman,A,Jl. Makmur No. 54,Lubang Buaya,Cipayung
20110615,TK Bangun,B,Jl. Lanji No. 2,Papanggo,Tanjung Priok
20178020,TK Bani Sholeh Basmol,Tidak Terakreditasi,Gg. H. Sholeh No.81,Kembangan Utara,Kembangan
20110903,TK Bank Dagang Negara,A,Jl. Komp. BDN Pesing Wesel,Wijaya Kusuma,Grogol Petamburan
,TK Baptis,Tidak Terakreditasi,Jl. Komp. Cengkareng Indah Blok GB No.1,Kapuk,Cengkareng
20110387,TK Baptis,B,"Jl. Bungur Besar XVII No.13 kemayoran, Jakpus",Gunung Sahari Selatan,Kemayoran
20110905,TK Baptis Elim,B,Jl. Dr. Susilo I/388,Grogol,Grogol Petamburan
20110906,TK Barunawati II,B,Jl.Aipda KS. Tubun III Komp.Pelni,Slipi,Palmerah
20110617,TK Barunawati VI,A,Jl. Anjungan No. 16 Komplek BPP Walang,Rawa Badak Utara,K o j a
20110618,TK Barunawati VIII,B,Jl. Kramat Jaya Komp. Deperla,Tugu Utara,K o j a
20110225,TK Basma Aliifah,Tidak Terakreditasi,Komplek Perumahan Bina Marga No. 41,Cipayung,Cipayung
20110163,TK Batu Karang,Tidak Terakreditasi,Jl. Raya Ciracas No. 10,Ciracas,Ciracas
20111407,TK Bayangkari 25,Tidak Terakreditasi,Jl. Ciputat Raya NO.40,Pondok Pinang,Kebayoran Lama
69857035,TK Bengawan,A,Jl. Bendungan Melayu No. 8,Rawa Badak Selatan,K o j a
20111408,TK Bentara Indonesia,A,Jl. Bendungan No. 25.,Pejaten Barat,Pasar Minggu
20110038,TK Bentara Indonesia I,A,Jl. Mulya Jaya No. 6,Cipinang Muara,Jatinegara
20111857,TK Bentara Indonesia II,B,Jl. E. I. No. 12 Cipinang Timur,Cipinang,Pulo Gadung
20110620,TK Bentara Indonesia IV,A,Jl. Villa Sunter MAs Blok H9 No. 8,Sunter Jaya,Tanjung Priok
20111409,TK Berdikari,Tidak Terakreditasi,Jl. Ros Timur V No. 2,Bukit Duri,T e b e t
20110389,TK Berita Hidup,Tidak Terakreditasi,Jl. Kartini XA dalam No.4,Kartini,Sawah Besar
20110042,TK Bestari,B,Jl. Baru Cipinang Muara No. 23,Cipinang Muara,Jatinegara
20110907,TK Betania,Tidak Terakreditasi,Jl. Jelambar Utama IV/3,Jelambar,Grogol Petamburan
20110488,TK Bethany I/ ANGLO,A,Jl. Rawasari Selatan 10 X,Rawasari,Cempaka Putih
20110908,TK Bhakti,A,Jl. Sakti IV,Kemanggisan,Palmerah
20111410,TK Bhakti Atomita,B,Jl. Komp. Batan A6 Rw. Bambu.,Pasar Minggu,Pasar Minggu
20111724,TK Bhakti Ibu,B,Jl. SMA XIV No. 22,Cililitan,Kramat Jati
20111859,TK Bhakti III,Tidak Terakreditasi,Jl. Bekasi Timur IV Ujung,Cipinang Besar Utara,Jatinegara
20110909,TK Bhakti Indria,Tidak Terakreditasi,Jl. Remujung No. 1,Joglo,Kembangan
,TK Bhakti Utama,Tidak Terakreditasi,Jl. Krendang Selatan No. 18 A,Kredang,Tambora
20110391,TK Bhayangkari,Tidak Terakreditasi,Jl. Sutan Syahrir No. 1,Gondangdia,Menteng
20110910,TK Bhineka Tunggal Ika,A,Jl. Kh. Moh. Mansyur No. 222-A,Tanah Sareal,Tambora
,TK Biji Gandum,Tidak Terakreditasi,"Jl. Prof. Dr. Supomo, SH. No. 210",Menteng Dalam,T e b e t
20110622,TK Bina Balita,C,Jl. Kebantenan V,Semper Timur,Cilincing
20111861,TK Bina Cempaka,B,Jl. Kayu Tinggi Cakung Timur,Cakung Timur,Cakung
20110623,TK Bina Harapan,C,Jl. Mengkudu V/M/21,Lagoa,K o j a
20111411,TK Bina Harapan I,A,Jl. Komp. DDN II Rt. 5/1 No. 33,Pondok Labu,Cilandak
20110911,TK Bina Insan,B,"Jl. Meruya Ilir, Komp. Qaryah Thayyibah Blok C",Srengseng,Kembangan
,TK Bina Insan Kamil,Tidak Terakreditasi,Jl. Pramuka Sari II No. 10,Rawasari,Cempaka Putih
20110912,TK Bina Insan Kamil,Tidak Terakreditasi,Jl. Peta Barat Blok B No. 1,Kalideres,Kalideres
20110913,TK Bina Insani,Tidak Terakreditasi,Jl. Peta Selatan,Kalideres,Kalideres
20110915,TK Bina Kusuma,A,Jl. Komp. Citra I Blok I/3,Kalideres,Kalideres
,TK Bina Kusuma II,A,Perumahan Citra II Ext Blok BI 2 No. 1-3,Pegadungan,Kalideres
69831002,TK Bina Mulia,Tidak Terakreditasi,Jl. Tebet Barat II E,Tebet Barat,T e b e t
20109787,TK Bina Putera,Tidak Terakreditasi,Jl. Swadaya Pulo Jahe,Jatinegara,Cakung
69940329,TK Bina Putik,Tidak Terakreditasi,Jl. Cempaka Putih Barat III / 26,Cempaka Putih Barat,Cempaka Putih
20110916,TK Bina Putra,Tidak Terakreditasi,Jl. Taman Toram X No. 29,Tegal Alur,Kalideres
20111862,TK Bina Putra,B,Jl. H. Baping No. 54,Ciracas,Ciracas
20111863,TK Bina Siswa,Tidak Terakreditasi,Jl. Pulogebang,Pulo Gebang,Cakung
69934539,TK Bina Tunas Bangsa,Tidak Terakreditasi,Jalan Pluit Timur Blok MM,Pluit,Penjaringan
20110244,TK Bina Warga,Tidak Terakreditasi,Jl. Cibubur II,Cibubur,Ciracas
,TK Bintang,Tidak Terakreditasi,Jl. Damai Musyawarah No. 12,Pondok Labu,Cilandak
,TK Bintang Bangsaku,Tidak Terakreditasi,Jl. Penjernihan I No. 30,Bendungan Hilir,Tanah Abang
,TK Bintang Bintang,Tidak Terakreditasi,Jl. Tebet Raya No. 72,Tebet Timur,T e b e t
20110392,TK Bintang Kecil,A,Jl. Kartini VII B / 5,Kartini,Sawah Besar
20111864,TK Bintang Kecil,C,Jl. Rawamangun Muka III/4,Rawamangun,Pulo Gadung
69933349,TK Bintang Kecil,Tidak Terakreditasi,PTB Duren Sawit No. 1,Duren Sawit,Duren Sawit
20110918,TK Bintang Kejora,A,Jl. Cengkareng Indah,Kapuk,Cengkareng
20111865,TK Bintang Pancasila,Tidak Terakreditasi,Jl. Baru Pengarengan,Jatinegara,Cakung
20110393,TK Bintang Timur,Tidak Terakreditasi,Jl. Taruna Jaya II Gg. Anggrek I No.7,Serdang,Kemayoran
20110919,TK Bless Kids School,A,Jl. Palapa Raya No. 16,Tegal Alur,Kalideres
69830957,TK Blossom,Tidak Terakreditasi,Jl. Mampang Prapatan VIII/35,Tegal Parang,Mampang Prapatan
20111415,TK Boncel,A,Jl. Desa Putera No. 5 Gg. Boncel,Srengseng Sawah,Jagakarsa
20111415,TK Boncel,A,Jl. Desa Putera No. 5 Gg. Boncel,Srengseng Sawah,Jagakarsa
20110624,TK Borobudur,Tidak Terakreditasi,Jl. Nusantara VII Blok E 24,Sunter Agung,Tanjung Priok
20110242,TK Bougenville,Tidak Terakreditasi,Jl. Regalia,Susukan,Ciracas
20110606,TK BPK Penabur VI,A,Jl. Hibrida Raya Blok QA/3,Kelapa Gading Barat,Kelapa Gading
20110897,TK BPKB,Tidak Terakreditasi,Jl. Kebon Jeruk Raya No. 1A,Kebon Jeruk,Kebon Jeruk
20109710,TK BPS & K Pembangunan,B,Jl. Pisangan Lama III No. 3,Pisangan Timur,Pulo Gadung
20111845,TK BPS & K Pembangunan III,Tidak Terakreditasi,Jl. Cipinang Jaya No. 44,Cipinang,Pulo Gadung
20111847,TK BPS&K V,Tidak Terakreditasi,Jl. Bunga Rampai III No. 22,Malaka Jaya,Duren Sawit
,TK Bright Kid Preschool,Tidak Terakreditasi,Jln. Pademangan I Gg. IV No. 1,Pademangan Timur,Pademangan
20110920,TK Bright Strars,Tidak Terakreditasi,Jl. Palma Raya DXI/1,Kedoya Selatan,Kebon Jeruk
,TK Buana Kids,,Jl. Amil No. 23,Pejaten Barat,Pasar Minggu
20111866,TK Budaya,Tidak Terakreditasi,Jl. Kavling Bulak Raya,Klender,Duren Sawit
69832197,TK Budaya,B,Jl. Duri Utara III No. 35,Duri Utara,Tambora
20111417,TK Budaya II,Tidak Terakreditasi,Jl. H. Shibi Kmp. Sawah,Srengseng Sawah,Jagakarsa
20111867,TK Budhaya I,B,Jl. Cipinang Kebembem I No. 25,Cipinang,Pulo Gadung
20110116,TK Budhaya II St. Agustinus,A,Jl. Raya Perumnas Buaran,Duren Sawit,Duren Sawit
69830960,TK Budhi Asri,A,Jl. Mampang Prapatan VIII D No. 17,Tegal Parang,Mampang Prapatan
20110922,TK Budhi Luhur,Tidak Terakreditasi,Jl. Prepedan Raya,Tegal Alur,Kalideres
20111419,TK Budhi Siwi,Tidak Terakreditasi,Jl. Sawo manila n0 14,Pasar Minggu,Pasar Minggu
20110823,TK Budi,C,Jl. Jembatan Besi II No. 44,Jembatan Besi,Tambora
69820776,TK BUDI,C,JL. JEMBATAN BESI II NO. 44,Jembatan Besi,Tambora
20110625,TK Budi Agung,A,Jl. Terusan Bandengan Utara No. 95 Blok F3-12,Pejagalan,Penjaringan
20111420,TK Budi Asih,B,Jl. Bukit Tinggi No. 3,Pasar Manggis,Setia Budi
20110923,TK Budi Bahasa,B,Jl. Kali Anyar IV No. 1,Kalianyar,Tambora
20111869,TK Budi Bakti,C,Jl. Nurul Kena Iman,Cipinang Melayu,Makasar
69831018,TK Budi Bakti,Tidak Terakreditasi,Jl. Tebet Timur Dalam III F no 15,Tebet Timur,T e b e t
20110183,TK Budi Darma I,Tidak Terakreditasi,Jl. Cipinang Muara No. 11,Cipinang Muara,Jatinegara
20110279,TK Budi Harapan,B,Jl. Kesenian,Cipinang Melayu,Makasar
20111422,TK Budi Harapan I,Tidak Terakreditasi,Jl. Alteri Permata Hijau,Grogol Utara,Kebayoran Lama
20111424,TK Budi Jaya,Tidak Terakreditasi,Jl. H. Muktar,Petukangan Utara,Pesanggrahan
69830963,TK Budi Jaya,B,Jl. Gg. H. Marzuki,Mampang Prapatan,Mampang Prapatan
20110394,TK Budi Mulia,A,Jl. Mangga Besar Raya No.135,Mangga Dua Selatan,Sawah Besar
20110395,TK Budi Mulia,A,"Jl. Gunung Sahari Raya No. 91 Kemayoran, Jakpus",Gunung Sahari Selatan,Kemayoran
20111426,TK Budi Mulia,Tidak Terakreditasi,Jl. Kemandoran I No. 7A,Grogol Utara,Kebayoran Lama
20111427,TK Budi Pangerti,B,Jl. Raya Kebayoran Lama Gg. Buntu No. 5,Grogol Selatan,Kebayoran Lama
20109824,TK Budi Setya,Tidak Terakreditasi,Jl. Pulogebang Permai G4/21,Pulo Gebang,Cakung
20110626,TK Bukit Mulia,A,Jl. Pluit Karangsari VI no.1-10,Pluit,Penjaringan
20110925,TK Bukit Sinai,Tidak Terakreditasi,Jl. Samarasa I Dalam No. 50,Angke,Tambora
20110926,TK Bukit Sion,Tidak Terakreditasi,Jl. Komp. Taman Kebun Jeruk Interkon Blok G7,Meruya Selatan,Kembangan
,TK Bunayya Islamic Pre School,A,Jl. Kebon Nanas II No. 10,Grogol Utara,Kebayoran Lama
,TK Bunda,B,Jl. SMA 114 Swadaya I No. 8,Cililitan,Kramat Jati
20110396,TK Bunda,Tidak Terakreditasi,Jl. Berlian III No. 7,Sumur Batu,Kemayoran
,TK Bunda Bhakti,B,Jl. Fajar Baru Utara No. 28,Cengkareng Timur,Cengkareng
20110927,TK Bunda Hati Kudus,A,Jl. Rahayu No. 22,Jelambar,Grogol Petamburan
20110397,TK Bunda Mulia,A,Jl. AM. Sangaji No. 20,Petojo Utara,Gambir
90101122,TK Bunda Mulia School,,,Ancol,Pademangan
,TK Bunga Bangsa,Tidak Terakreditasi,Jl. H. Sarimun No. 108 Rt. 007/01,Kembangan Selatan,Kembangan
20110928,TK Bunga Bhakti,C,Jl. Maruya Ilir,Meruya Utara,Kembangan
20110627,TK Bunga Hati Bangsa,Tidak Terakreditasi,Jl. Vila Kapuk Indah Blok G no 1,Penjaringan,Penjaringan
,TK Bunga Melati,Tidak Terakreditasi,Jl. Jatinegara Lio No. 40,Jatinegara,Cakung
20111874,TK Bunga Rafflesia,Tidak Terakreditasi,Jl. H. Kamad No. 38,Pondok Bambu,Duren Sawit
20111429,TK Bunga Teratai,Tidak Terakreditasi,Jl. Pondok Pinang VI No. 44,Pondok Pinang,Kebayoran Lama
20109923,TK Cahaya Balita,B,"Jl. Waja V/4 Harapan Mulia,Jakpus",Kemayoran,Kemayoran
20110929,TK Cahaya Bunda,B,Jl. Mangga Besar VIII No. 5,Taman Sari,Taman Sari
20111876,TK Cahaya Bunda,Tidak Terakreditasi,Jl. Raya Bekasi Km. 17,Jatinegara,Cakung
20110628,TK Cahaya Kudus,C,Jl. MUARA KARANG Blok B IX S NO.129,Kapuk Muara,Penjaringan
20109563,TK Cahaya Mughni,B,JL. Lapangan Tembak Gg Rukun II,Cibubur,Ciracas
20109922,TK Cahaya Mutiara,Tidak Terakreditasi,Jl. Kp. Rawa I No.20,Kampung Rawa,Johar Baru
20110211,TK Cahaya Sakti,A,Jl. Otista I No. 11,Bali Mester,Jatinegara
20110930,TK Candra Jaya,A,Jl. Sawah Lio IV No. 8-B,Jembatan Lima,Tambora
20110931,TK Candra Naya,A,Jl. Jembatan Besi II No. 26,Jembatan Besi,Tambora
20110629,TK Capriasi Yoel,Tidak Terakreditasi,Jl. Kebantenan No. 1,Semper Timur,Cilincing
20110933,TK Carina Sayang,A,Jl. Carina Sayang Blok Z/6-9,Rawa Buaya,Cengkareng
69830825,TK Caterpillar,Tidak Terakreditasi,Jl. Lebak Bulus III No. 13,Cilandak Barat,Cilandak
,TK Cemara,Tidak Terakreditasi,Jl. Mahoni I B No. 21 Rt. 001/014,Lagoa,K o j a
20109739,TK Cemerlang,A,Jl. Gurame No. 17,Jati,Pulo Gadung
20110245,TK Cempaka,Tidak Terakreditasi,Jl. H. Jusin No. 21,Susukan,Ciracas
20110398,TK Cempaka,B,Jl. Suwiryo No. 16,Gondangdia,Menteng
20110399,TK Cempaka,Tidak Terakreditasi,"Jl. Kebon Kosong VII No.77, Kemayoran, Jakpus",Kebon Kosong,Kemayoran
20111431,TK Cempaka,Tidak Terakreditasi,Jl. H. Umaidi Rawa Bambu,Pasar Minggu,Pasar Minggu
20111879,TK Cempaka,Tidak Terakreditasi,Jl. Panca Warga II/2,Cipinang Besar Selatan,Jatinegara
20110401,TK Cempaka Jaya,B,Jl. Pangkalan Asem No. 1,Cempaka Putih Barat,Cempaka Putih
20110402,TK Cempaka Ria,B,Jl. Rawasari Timur I,Cempaka Putih Timur,Cempaka Putih
20110403,TK Cempaka Wangi,A,Jl. Cemput Barat II/B No. 24,Cempaka Putih Barat,Cempaka Putih
20111433,TK Cenderawasih,C,Jl. Kebon Mangga I,Cipulir,Kebayoran Lama
20110630,TK Cendrana Indonesia,Tidak Terakreditasi,Jl. Kalibaru Barat VII No. 40,Kalibaru,Cilincing
20110934,TK Cendrawasih,B,Jl. Anggrek Cendrawasih Raya,Kemanggisan,Palmerah
20111432,TK Cendrawasih,B,JL. H. GAIM,Petukangan Utara,Pesanggrahan
69902606,TK Cerdas Ceria,Tidak Terakreditasi,Jl. Penyelesaian Tomang I/22 Kav. DKI Blok 117,Meruya Utara,Kembangan
20111880,TK Ceria,B,Jl. Komodor Udara Halim PK,Halim Perdana Kusumah,Makasar
20110404,TK Chandra,B,Jl. Mortir No. 7 Kompleks KODAM Sumur Batu,Sumur Batu,Kemayoran
20110631,TK Chandra Kusuma,A,Jl. Vikamas I Blok H4 No. 1,Kapuk Muara,Penjaringan
20111435,TK Charitas St. Stephanus,A,Jl. Swakarya C 13 A Pondok Labu,Pondok Labu,Cilandak
20109741,TK Cheria,Tidak Terakreditasi,Jl. Layur No. 27,Jati,Pulo Gadung
20111436,TK Cherry Preschool,A,Jl. H. Batong Raya No. 6,Cilandak Barat,Cilandak
,TK Cikal,Tidak Terakreditasi,Jl. TB. Simatupang Kav. 18,Cilandak Barat,Cilandak
,TK Cikal Bangsa,Tidak Terakreditasi,Jl. RSB Blok Cempaka Lt. No. 1,Penjaringan,Penjaringan
20109801,TK Cinta Ananda,Tidak Terakreditasi,Kp. Pedaengan Rt. 02/08 No. 3,Penggilingan,Cakung
,TK Cinta Kasih Tzu Chi,Tidak Terakreditasi,Kamal Raya Outer Ringroad No. 20,Cengkareng Timur,Cengkareng
20111437,TK Ciputra,C,Jl. Sawo III/44,Cipete Utara,Kebayoran Baru
,TK Cita Buana,A,Jl. Paso Raya No. 84,Jagakarsa,Jagakarsa
,TK Citra,Tidak Terakreditasi,Jl. Udayana No. 1,Kebon Pala,Makasar
20111882,TK Citra,Tidak Terakreditasi,Jl. PONDOK KOPI BLOK T7 NO.8,Pondok Kopi,Duren Sawit
20111438,TK Citra Alam Ciganjur,Tidak Terakreditasi,"Jl. Damai II, No. 54",Ciganjur,Jagakarsa
20110935,TK Citra Kasih,A,Citra 2 Ext Blok BI No. 11-12,Pegadungan,Kalideres
,TK Citra Mulya I,Tidak Terakreditasi,Jl. Aselih 95,Cipedak,Jagakarsa
20110405,TK Citra Mu'min,B,Jl. Kebon Kacang No. 48,Kebon Kacang,Tanah Abang
20111439,TK Citra Siwi,Tidak Terakreditasi,Jl. Ragunan,Ragunan,Pasar Minggu
20111884,TK Cor. Ipsu Marsudirini,A,Jl. Matraman Raya 129,Pal Meriem,Matraman
20111885,TK Curug Indah,Tidak Terakreditasi,Jl. Curug Raya,Pondok Kelapa,Duren Sawit
20110936,TK Daarul Fikri,Tidak Terakreditasi,Jl. Gaga Kampung Malang,Semanan,Kalideres
20179537,TK Daarul Ghufron,Tidak Terakreditasi,Jl. Luar Batang V No. 22,Penjaringan,Penjaringan
,TK Daarul Hayaat,Tidak Terakreditasi,Jl warakas IX no 17,Warakas,Tanjung Priok
20110937,TK Daarul Mu'min,Tidak Terakreditasi,Jl. 20 Desember Rt 006 / 003 No. 30,Pegadungan,Kalideres
69790684,TK Daarul Muttaqien,Tidak Terakreditasi,Jl. Duri Utara I Gg. Pasti No. 9,Duri Utara,Tambora
NP473428,TK DAARUL QUR'AN,Tidak Terakreditasi,Kalibata City Tower Sakura Lt. 2,Rawajati,Pancoran
,TK Daarun Naaib,Tidak Terakreditasi,Jl.Akasia III,Cengkareng Timur,Cengkareng
20110941,TK Daarut Taqwa,Tidak Terakreditasi,Jl. Raya Kapuk No. 4 Gg. Masjid,Kapuk,Cengkareng
20110632,TK Dahlia,B,Jl. Yos Sudarso II/15,Kebon Bawang,Tanjung Priok
69832195,TK Damai,B,Jl. Duri Selatan V / 29,Duri Selatan,Tambora
20110633,TK Damai Sejahtera,Tidak Terakreditasi,Jl. Kalibaru Timur I no. 9,Kalibaru,Cilincing
69857031,TK Darma Bakti,Tidak Terakreditasi,Jl. Muara Bahari No.15,Tanjung Priok,Tanjung Priok
20110635,TK Darma Budi Bhakti,B,Jl. Agung Tengah 7 No. 1,Sunter Agung,Tanjung Priok
20111440,TK Darma Putra Nusantara 86,B,Jl. Pinang IV No. 88,Pondok Labu,Cilandak
20110636,TK Darma Satria Persada,A,Jl.Teluk Indah Blok Q No.24-29,Pejagalan,Penjaringan
20110637,TK Darma Siwi,A,Jl. Sunter Agung Utara,Sunter Agung,Tanjung Priok
20110209,TK Darul Arqom,Tidak Terakreditasi,Jl. Bekasi Timur IV,Cipinang Besar Utara,Jatinegara
,TK Darul Fathin,Tidak Terakreditasi,Jl. Al Barokah No. 126,Duri Kosambi,Cengkareng
20110204,TK Darul Hikmah,B,Jl. Panca Warga II/38,Cipinang Besar Selatan,Jatinegara
20112524,TK Darul Ilmi,Tidak Terakreditasi,Jl. Tanah Koja,Duri Kosambi,Cengkareng
20110638,TK Darul Ma'arif,Tidak Terakreditasi,Jl. Madya Kebantenan No. 14,Semper Timur,Cilincing
20111441,TK Darul Ma'arif,B,Jl. RS. Fatmawati No. 45,Cipete Selatan,Cilandak
20111442,TK Darul Muttaqin,A,Jl. H. Gaim no 126,Pesanggrahan,Pesanggrahan
69830963,TK Darul Muttaqin,Tidak Terakreditasi,Jl. Kemang Utara C No. 52,Bangka,Mampang Prapatan
20111445,TK Darul Ulum,B,Karet Pedurenan No. 53,Karet Kuningan,Setia Budi
20110939,TK Darun Naim,Tidak Terakreditasi,Jl. Semanan Raya No. 15,Semanan,Kalideres
20110940,TK Darun Nisa,Tidak Terakreditasi,Jl. Tanjung Pura V No. 22,Pegadungan,Kalideres
20111446,TK Darunnajah,B,Jl. Ulujami Raya,Ulujami,Pesanggrahan
20111894,TK Darus`salam,A,Jl. Jatinegara Kaum I,Jatinegara Kaum,Pulo Gadung
69830967,TK Darussa`adah,Tidak Terakreditasi,Jl. Poncol Jaya No. 41,Kuningan Barat,Mampang Prapatan
20110408,TK Darussalam,Tidak Terakreditasi,Jl. Batang Hari No. 42A,Cideng,Gambir
20110639,TK Darussalam,C,Jl. Mawar Dalam No. 41,Lagoa,K o j a
20111448,TK Darussalam,Tidak Terakreditasi,Jl. Ciputat Raya Gg H Romlah,Pondok Pinang,Kebayoran Lama
