npsn,nama_sekolah,akreditasi,alamat,kelurahan,kecamatan
20100590,SDN Semper Timur 04 Pt.,B,Jl. Kebantenan IV/ 19,Semper Timur,Cilincing
20100591,SDN Semper Timur 05 Pg.,A,Jl. Kebantenan IV/ 19,Semper Timur,Cilincing
20104915,SDN Semper Timur 07 Pg.,A,Jl. Kebantenan IV No 35,Semper Timur,Cilincing
20104674,SDN Senen 03 Pg.,A,Jl. Abdul Rahman Saleh I/ 8,Senen,S e n e n
20104675,SDN Serdang 01 Pg.,A,Jl. Lapangan Pors,Serdang,Kemayoran
20104676,SDN Serdang 03 Pg.,B,Jl. Lapangan Pors,Serdang,Kemayoran
20104679,SDN Serdang 05 Pg.,A,Jl. Eka Lima RT 09/03 Serdang,Serdang,Kemayoran
20104681,SDN Serdang 07,B,Jl. Kp. Irian II No. 24,Serdang,Kemayoran
20104683,SDN Serdang 11 Pg.,B,Jl. Kp. Irian II No. 24,Serdang,Kemayoran
20104685,SDN Serdang 13 Pg.,B,Jl. Serdang Baru XIII No.48,Serdang,Kemayoran
20106186,SDN Setiabudi 01 Pg.,A,Jl. Setiabudi Barat No. 8 K,Setia Budi,Setia Budi
20103465,SDN Setu 01 Pg.,A,Jl. Rukun,Setu,Cipayung
20103464,SDN Setu 02 Pg.,A,Jl. Rukun Setu,Setu,Cipayung
20105495,SDN Slipi 01,A,Jl. K.S. Tubun III No. 40,Slipi,Palmerah
20105499,SDN Slipi 07 Pg.,A,Jl. G. II,Slipi,Palmerah
20105501,SDN Slipi 11 Pg.,A,Jl. Z Slipi Dalam Rt. 11/02,Slipi,Palmerah
20101428,SDN Slipi 15 Pg.,A,Jl. K.S. Tubun III Dalam,Slipi,Palmerah
20105505,SDN Slipi 18 Pg.,A,Jl. K.S. Tubun III Dalam No. 37,Slipi,Palmerah
20105506,SDN Srengseng 01 Pg.,A,Jl. Raya Srengseng,Srengseng,Kembangan
20105508,SDN Srengseng 03 Pg.,B,Jl.Perumahan Taman Kebon Jeruk,Srengseng,Kembangan
20105509,SDN Srengseng 04 Pg.,A,Jl. Raya Srengseng No. 24A,Srengseng,Kembangan
20105510,SDN Srengseng 05 Pg.,A,Jl. Srengseng Raya No. 56,Srengseng,Kembangan
20105511,SDN Srengseng 06 Pg.,A,Jl. Srengseng Raya No. 56,Srengseng,Kembangan
20105513,SDN Srengseng 08 Pt.,A,Jl. Srengseng Raya No. 56,Srengseng,Kembangan
20102247,SDN Srengseng Sawah 01 Pg.,A,Jl. Moch. Kahfi II No.16,Srengseng Sawah,Jagakarsa
20106188,SDN Srengseng Sawah 02 Pt.,A,Jl. Moh. Kahfi II,Srengseng Sawah,Jagakarsa
20106189,SDN Srengseng Sawah 03 Pg.,A,Jl. Moh. Kahfi II Rt. 001/05,Srengseng Sawah,Jagakarsa
20102246,SDN Srengseng Sawah 04 Pg.,A,Jl. Srengseng Sawah,Srengseng Sawah,Jagakarsa
20106193,SDN Srengseng Sawah 07,A,Jl. Srengseng Sawah No. 10,Srengseng Sawah,Jagakarsa
20102244,SDN Srengseng Sawah 10 Pt.,A,Jl. Moh. Kahfi II,Srengseng Sawah,Jagakarsa
20106195,SDN Srengseng Sawah 11 Pg.,A,Jl. Bina Warga Rt.08/07 No.73,Srengseng Sawah,Jagakarsa
20106196,SDN Srengseng Sawah 12 Pg.,A,Jl. H. SIBI,Srengseng Sawah,Jagakarsa
20106198,SDN Srengseng Sawah 14 Pg.,A,Jl. H. Sibi,Srengseng Sawah,Jagakarsa
20106199,SDN Srengseng Sawah 15 Pg.,B,Jl. Gardu,Srengseng Sawah,Jagakarsa
20106201,SDN Srengseng Sawah 17 Pg.,A,Jl. Cipedak,Srengseng Sawah,Jagakarsa
20105514,SDN Sukabumi Selatan 01 Pg.,A,Jl. Raya Sukabumi Selatan,Sukabumi Selatan,Kebon Jeruk
20105515,SDN Sukabumi Selatan 03 Pg.,A,Jl. Raya Sukabumi,Sukabumi Selatan,Kebon Jeruk
20105516,SDN Sukabumi Selatan 05 Pg.,A,Jl. KPBD Rt 09/01 No.50,Sukabumi Selatan,Kebon Jeruk
20105517,SDN Sukabumi Selatan 06 Pg.,A,Jl. Z Sukabumi Selatan,Sukabumi Selatan,Kebon Jeruk
20105518,SDN Sukabumi Selatan 07 Pg.,B,Jl. Raya Pos Pengumben,Sukabumi Selatan,Kebon Jeruk
20105519,SDN Sukabumi Utara 01 Pg.,A,Jl. Adam Rt. 005/ 011 No. 1,Sukabumi Utara,Kebon Jeruk
20101188,SDN Sukabumi Utara 03,A,Jl. Harun Raya No.49,Sukabumi Utara,Kebon Jeruk
20101199,SDN Sukabumi Utara 04 Pg.,B,Jl. Daud Raya,Sukabumi Utara,Kebon Jeruk
20105521,SDN Sukabumi Utara 05 Pg.,A,Jl. Salam III,Sukabumi Utara,Kebon Jeruk
20105522,SDN Sukabumi Utara 07 Pg.,A,Jl. Salam Raya Rt.,Sukabumi Utara,Kebon Jeruk
20105523,SDN Sukabumi Utara 08 Pg.,A,JL. SULAIMAN,Sukabumi Utara,Kebon Jeruk
20105524,SDN Sukabumi Utara 09 Pg.,A,Jl. Yusuf No.5,Sukabumi Utara,Kebon Jeruk
20100593,SDN Sukapura 01 Pg.,A,Jl. Beo No.15 Komp.Walikota,Sukapura,Cilincing
20104916,SDN Sukapura 02,A,Jl. Tipar Cakung gg. Kompi Jenggot No.28,Sukapura,Cilincing
20100596,SDN Sukapura 04 Pg.,A,Jl. Tipar Cakung Gg. Bambu Kuning,Sukapura,Cilincing
20104917,SDN Sukapura 05 Pg.,A,Jl. Tipar Cakung,Sukapura,Cilincing
20104918,SDN Sukapura 06 Pt.,A,Komp. WaLIKOTA Jl. Beo No.15,Sukapura,Cilincing
20104687,SDN Sumur Batu 01 Pg.,A,"Jl. Sumur Batu Raya, Gang CC, No. 40",Sumur Batu,Kemayoran
20104688,SDN Sumur Batu 03 Pg.,B,Jl. Sumur Batu Utara No. 2,Sumur Batu,Kemayoran
20104689,SDN Sumur Batu 04 Pg.,B,Jl. Sumur Batu Utara No. 2,Sumur Batu,Kemayoran
20104690,SDN Sumur Batu 06 Pg.,A,Jl. Sumur Batu Utara No. 2,Sumur Batu,Kemayoran
20104692,SDN Sumur Batu 08 Pg.,A,Jl. Sumur Batu Utara No. 2,Sumur Batu,Kemayoran
20104694,SDN Sumur Batu 12 Pg.,A,Jl. Nilam Raya No. 6,Sumur Batu,Kemayoran
20104695,SDN Sumur Batu 14 Pg.,A,Jl. Nilam Raya No. 6,Sumur Batu,Kemayoran
20104696,SDN Sumur Batu 15 Pt.,B,Jl. Nilam Raya No. 6,Sumur Batu,Kemayoran
20104919,SDN Sungai Bambu 01 Pg.,A,Jl. Gadang No. 52,Sungai Bambu,Tanjung Priok
20104921,SDN Sungai Bambu 03,A,Jl. Gadang No. 52,Sungai Bambu,Tanjung Priok
20104923,SDN Sungai Bambu 05 Pg.,A,Jl. Sungai Bambu III NO 34,Sungai Bambu,Tanjung Priok
20104925,SDN Sunter Agung 01,A,Jl. Ancol Selatan I No. 1,Sunter Agung,Tanjung Priok
20104927,SDN Sunter Agung 03 Pg.,A,Jl. Agung Jaya 15 Blok D,Sunter Agung,Tanjung Priok
20104929,SDN Sunter Agung 05 Pg.,B,Jl. Agung Utara No. 13,Sunter Agung,Tanjung Priok
20104930,SDN Sunter Agung 07 Pg.,A,Jl. Danau Agung III Blok E3,Sunter Agung,Tanjung Priok
20104932,SDN Sunter Agung 09 Pg.,A,Jl. Sunter Permai Raya No.21,Sunter Agung,Tanjung Priok
20104934,SDN Sunter Agung 11 Pg.,A,Jl. Nusantara Selatan Komp. Secna,Sunter Agung,Tanjung Priok
20104935,SDN Sunter Agung 12 Pg.,A,Jl. Paradise 10 Blok F. 19-20,Sunter Agung,Tanjung Priok
20104936,SDN Sunter Agung 13 Pg.,A,Jl. RS. Ancol Komp.Graha Str Pratama,Sunter Agung,Tanjung Priok
20104937,SDN Sunter Jaya 01 Pg.,A,Jl. Sunter Jaya IV A,Sunter Jaya,Tanjung Priok
20104938,SDN Sunter Jaya 02 Pt.,A,Jl. Sunter Jaya IV A,Sunter Jaya,Tanjung Priok
20100579,SDN Sunter Jaya 03 Pg.,A,Jl. Sunter Jaya IV A,Sunter Jaya,Tanjung Priok
20104939,SDN Sunter Jaya 04 Pt.,A,Jl. Sunter Jaya IV A,Sunter Jaya,Tanjung Priok
20104940,SDN Sunter Jaya 05 Pg.,A,Jl. Sunter Jaya IV A,Sunter Jaya,Tanjung Priok
20104941,SDN Sunter Jaya 06 Pt.,B,Jl. Sunter Jaya IV A,Sunter Jaya,Tanjung Priok
20104942,SDN Sunter Jaya 07,B,Jl. Sunter Jaya VI No. 31,Sunter Jaya,Tanjung Priok
20104944,SDN Sunter Jaya 09 Pg.,A,Jl. Danau Indah No. II,Sunter Jaya,Tanjung Priok
20108782,SDN Susukan 01 Pg.,A,Jl. Makmur IV,Susukan,Ciracas
20103461,SDN Susukan 02 Pg.,A,Jl. Makmur IV Rt. 009/ 02,Susukan,Ciracas
20103460,SDN Susukan 03 Pg.,A,Jl. H. Baping,Susukan,Ciracas
20103449,SDN Susukan 04 Pg.,A,Jl. H. Baping,Susukan,Ciracas
20103448,SDN Susukan 05 Pg.,A,Jl. H. Baping,Susukan,Ciracas
20103447,SDN Susukan 06 Pg.,A,Jl. Tanah Merdeka,Susukan,Ciracas
20103446,SDN Susukan 07 Pg.,A,Jl. Tanah Merdeka,Susukan,Ciracas
20103445,SDN Susukan 08 Pg.,A,Jl. H. Baping Rt. 010/ 06,Susukan,Ciracas
20109126,SDN Susukan 09 Pg.,A,Jl. Tanah Merdeka No. 20,Susukan,Ciracas
20105525,SDN Taman Sari 01 Pg.,A,Jl. Taman Sari X No. 17 A,Taman Sari,Taman Sari
20105526,SDN Taman Sari 03 Pg.,B,Jl. Taman Sari X No. 17 A,Taman Sari,Taman Sari
20105527,SDN Taman Sari 05,A,Jl. Taman Sari X No. 17 A,Taman Sari,Taman Sari
20105529,SDN Taman Sari 07 Pg.,B,Jl. Mangga Bsr VI Sel. No.11,Taman Sari,Taman Sari
20105530,SDN Taman Sari 08 Pg.,A,Jl. Mangga Bsr VI Sel. No.11,Taman Sari,Taman Sari
20105531,SDN Taman Sari 09 Pg.,A,Jl. Tamansari X No. 17 A,Taman Sari,Taman Sari
20105532,SDN Tambora 01 Pg.,A,Jl. Perniagaan No. 31,Tambora,Tambora
20105533,SDN Tambora 02 Pt.,B,Jl. Perniagaan No. 31,Tambora,Tambora
20105534,SDN Tambora 03 Pg.,B,Jl. Perniagaan No. 31,Tambora,Tambora
20105535,SDN Tanah Sereal 01 Pg.,A,Jl. Pekapuran Raya No. 66,Tanah Sareal,Tambora
20105536,SDN Tanah Sereal 02 Pt.,A,Jl. Pekapuran Raya No. 66,Tanah Sareal,Tambora
20105537,SDN Tanah Sereal 03 Pg.,A,Jl. TANAH SEREAL XIII / 25,Tanah Sareal,Tambora
20105538,SDN Tanah Sereal 04 Pt.,A,Jl. Tanah Sereal XIII No. 25,Tanah Sareal,Tambora
20104697,SDN Tanah Tinggi 01 Pg.,A,Jl. Tanah Tinggi I Gg. II Kec.Johar Baru,Tanah Tinggi,Johar Baru
20104698,SDN Tanah Tinggi 02 Pt.,A,Jl. Tanah Tinggi I Gg. II,Tanah Tinggi,Johar Baru
20104699,SDN Tanah Tinggi 03 Pg.,A,Jl. Tanah Tinggi II/ 8,Tanah Tinggi,Johar Baru
20104700,SDN Tanah Tinggi 04 Pt.,B,Jl. Tanah Tinggi II/ 8,Tanah Tinggi,Johar Baru
20104701,SDN Tanah Tinggi 05 Pg.,A,Jl. Tanah Tinggi II/ 8,Tanah Tinggi,Johar Baru
20104702,SDN Tanah Tinggi 06 Pt.,B,Jl. Tanah Tinggi II/ 8,Tanah Tinggi,Johar Baru
20104703,SDN Tanah Tinggi 07 Pg.,A,Jl. Tanah Tinggi II/ 8,Tanah Tinggi,Johar Baru
20104704,SDN Tanah Tinggi 09 Pg.,A,Jl. Kramat Pulo Gundul III,Tanah Tinggi,Johar Baru
20104705,SDN Tanah Tinggi 10 Pt.,A,Jl. Kramat Pulo Gundul III,Tanah Tinggi,Johar Baru
20104706,SDN Tanah Tinggi 11 Pg.,B,Jl. Tanah Tinggi I Gg. II,Tanah Tinggi,Johar Baru
20106202,SDN Tanjung Barat 01 Pg.,B,Jl. Nangka,Tanjung Barat,Jagakarsa
20102239,SDN Tanjung Barat 03 Pg.,A,Jl. Ranco Indah Rt. 008/ 02,Tanjung Barat,Jagakarsa
20102238,SDN Tanjung Barat 04 Pg.,A,Jl. Muara H.Harun,Tanjung Barat,Jagakarsa
20106203,SDN Tanjung Barat 05,A,JL. RANCHO INDAH NO. 42,Tanjung Barat,Jagakarsa
20102237,SDN Tanjung Barat 07 Pg.,A,Jl. Nangka No.10,Tanjung Barat,Jagakarsa
20102249,SDN Tanjung Barat 09 Pg.,A,Jl. Swadaya II,Tanjung Barat,Jagakarsa
20105539,SDN Tanjung Duren Selatan 01 Pg.,A,Jl. Tanjung Duren Timur V/26,Tanjung Duren Selatan,Grogol Petamburan
20105542,SDN Tanjung Duren Selatan 05 Pg.,B,Jl. Tanjung Duren Dalam IV/25,Tanjung Duren Selatan,Grogol Petamburan
20105544,SDN Tanjung Duren Utara 01 Pg.,A,Jl. Tanjung Duren Utara III/ 3,Tanjung Duren Utara,Grogol Petamburan
20105545,SDN Tanjung Duren Utara 02 Pg.,A,Jl. Tanjung Duren Utara III/ E,Tanjung Duren Utara,Grogol Petamburan
20105547,SDN Tanjung Duren Utara 06 Pg.,A,Jl. Tanjung Duren Raya No. 20,Tanjung Duren Utara,Grogol Petamburan
20104946,SDN Tanjung Priok 01 Pg.,A,"Jl. Yos Sudarso, Edam II No. 13",Tanjung Priok,Tanjung Priok
20104947,SDN Tanjung Priok 02 Pg.,B,Jl. RE. Martadinata Gg.Samudera IX,Tanjung Priok,Tanjung Priok
20104948,SDN Tanjung Priok 03 Pt.,B,Jl. RE. Martadinata Samudra IX,Tanjung Priok,Tanjung Priok
20104949,SDN Tanjung Priok 04 Pg.,A,Jl. Kp. Bahari Gg. II Ujung,Tanjung Priok,Tanjung Priok
20104950,SDN Tanjung Priok 05 Pt.,A,JL BAHARI GANG II UJUNG,Tanjung Priok,Tanjung Priok
20102251,SDN Tebet Barat 01 Pg.,B,Jl. Tebet Barat Dalam VI,Tebet Barat,T e b e t
20102264,SDN Tebet Barat 03 Pg.,B,Jl. Tebet Barat Dalam VI,Tebet Barat,T e b e t
20102263,SDN Tebet Barat 05 Pg.,A,Jl. Tebet Dalam III,Tebet Barat,T e b e t
20102260,SDN Tebet Barat 08 Pg.,A,Jl. Tebet Barat X No 4,Tebet Barat,T e b e t
20102259,SDN Tebet Timur 01 Pg.,A,Jl. Tebet Timur I F No. 14 A,Tebet Timur,T e b e t
20102258,SDN Tebet Timur 03 Pg.,B,Jl. Tebet Timur IF No. 14 A,Tebet Timur,T e b e t
20102255,SDN Tebet Timur 07,A,Jl. Tebet Utara III,Tebet Timur,T e b e t
20102253,SDN Tebet Timur 11 Pg.,B,Jl. Tebet Timur Dalam X No.11,Tebet Timur,T e b e t
20106214,SDN Tebet Timur 15 Pg.,A,Jl. Tebet Timur Dalam III,Tebet Timur,T e b e t
20102233,SDN Tebet Timur 17 Pg.,B,Jl. Tebet Timur Dalam II G,Tebet Timur,T e b e t
20106216,SDN Tebet Timur 18 Pg.,A,Jl. Tebet Timur Dalam II G,Tebet Timur,T e b e t
20102205,SDN Tebet Timur 19 Pg.,A,Jl. Tebet Timur Dalam II G,Tebet Timur,T e b e t
20102204,SDN Tebet Timur 20 Pg.,A,Jl. Tebet Timur II G,Tebet Timur,T e b e t
20105549,SDN Tegal Alur 01 Pg.,A,Jl. Kamal Raya No. 14,Tegal Alur,Kalideres
20105560,SDN Tegal Alur 02 Pg.,A,Jl. Menceng Raya Rt.03/11,Tegal Alur,Kalideres
20105561,SDN Tegal Alur 03 Pg.,A,Jl. Mirinda PTIS Tegal Alur,Tegal Alur,Kalideres
20105562,SDN Tegal Alur 04 Pg.,A,Jl. Menceng Raya Rt.03/11,Tegal Alur,Kalideres
20105564,SDN Tegal Alur 06 Pg.,A,Jl. Lingkungan III,Tegal Alur,Kalideres
20105565,SDN Tegal Alur 07 Pg.,B,Jl. Lingkungan III Rt.01/03,Tegal Alur,Kalideres
20105566,SDN Tegal Alur 08 Pg.,A,Jalan Sekolah,Tegal Alur,Kalideres
20105568,SDN Tegal Alur 09 Pg.,B,Jl.Sekolah,Tegal Alur,Kalideres
20105569,SDN Tegal Alur 10 Pg.,A,Jl. Kapuk Kamal Raya,Tegal Alur,Kalideres
20105570,SDN Tegal Alur 11 Pg.,A,Komp. Kebersihan,Tegal Alur,Kalideres
20105571,SDN Tegal Alur 12 Pt.,A,Jl. Mirinda KAV. PTB,Tegal Alur,Kalideres
20105572,SDN Tegal Alur 13 Pt.,A,Jl. Sekolah,Tegal Alur,Kalideres
20105573,SDN Tegal Alur 14 Pt.,A,Jl. Kapuk Kamal,Tegal Alur,Kalideres
20105574,SDN Tegal Alur 15 Pg.,A,Jl. Kayu Besar,Tegal Alur,Kalideres
20105575,SDN Tegal Alur 16 Pt.,B,Jl. Sekolah,Tegal Alur,Kalideres
20105576,SDN Tegal Alur 17 Pg.,B,Jl. Kayu Besar,Tegal Alur,Kalideres
20105578,SDN Tegal Alur 19 Pt.,B,Jl. Raya Kamal No.14 Rt.01/02,Tegal Alur,Kalideres
20105579,SDN Tegal Alur 20 Pt.,B,Jl. Kayu Besar Rt. 001/ 02,Tegal Alur,Kalideres
20105580,SDN Tegal Alur 21 Pt.,B,Jl. Lingkungan III RT.001/03,Tegal Alur,Kalideres
20102203,SDN Tegal Parang 01 Pg.,A,Jl. Mampang Prapatan VIII,Tegal Parang,Mampang Prapatan
20102202,SDN Tegal Parang 03 Pg.,A,Jl. Mampang Prapatan VIIII,Tegal Parang,Mampang Prapatan
20102201,SDN Tegal Parang 05 Pg.,A,Jl. Mampang Prapatan VI/36,Tegal Parang,Mampang Prapatan
20102200,SDN Tegal Parang 06 Pg.,A,Jl. Mampang Prapatan XIII,Tegal Parang,Mampang Prapatan
20105581,SDN Tomang 01 Pg.,A,Jl. Mandala Utara Raya No. 1,Tomang,Grogol Petamburan
20101172,SDN Tomang 03 Pg.,A,Jl. Gelong Baru No.29A,Tomang,Grogol Petamburan
20101170,SDN Tomang 08 Pg.,A,Jl. Pulo Macan V 17,Tomang,Grogol Petamburan
20105587,SDN Tomang 11 Pg.,A,Jl. Rawa Kepa VII No. 12,Tomang,Grogol Petamburan
20100568,SDN Tugu Selatan 01,A,Jl. Balai Rakyat No. 17,Tugu Selatan,K o j a
20100565,SDN Tugu Selatan 03,A,Jl. Balai Rakyat No. 19,Tugu Selatan,K o j a
20104952,SDN Tugu Utara 01 Pg.,A,Jl. Mangga Ujung No.1D,Tugu Utara,K o j a
20104953,SDN Tugu Utara 02 Pt.,B,Jl.Mangga Ujung N0.2-3,Tugu Utara,K o j a
20104954,SDN Tugu Utara 03 Pg.,A,Jl. Mangga Ujung No.3,Tugu Utara,K o j a
20104956,SDN Tugu Utara 05 Pg.,B,Jl. Mangga Ujung No 2-3,Tugu Utara,K o j a
20104958,SDN Tugu Utara 07 Pg.,A,Jl. Turi No. 3,Tugu Utara,K o j a
20104959,SDN Tugu Utara 08 Pt.,B,Jl. Turi No. 3,Tugu Utara,K o j a
20100575,SDN Tugu Utara 09,A,Jl.Mahoni Ujung Komp.UKA,Tugu Utara,K o j a
20100577,SDN Tugu Utara 11,A,Komplek UKA,Tugu Utara,K o j a
20100598,SDN Tugu Utara 13 Pg.,A,Jl. Kr. Jaya Gg.VIII Blok R,Tugu Utara,K o j a
20100618,SDN Tugu Utara 14 Pg.,B,Jl. Kramat Jaya Gg.VIII Blok R No. 43,Tugu Utara,K o j a
20100619,SDN Tugu Utara 15 Pg.,A,Jl. H. M. Darpi Plump. Semper,Tugu Utara,K o j a
20100620,SDN Tugu Utara 16 Pt.,B,Jl. H. M. Darpi Plump. Semper,Tugu Utara,K o j a
20104963,SDN Tugu Utara 17 Pg.,A,Jl. Kramat Jaya Gg.VIII Blok R,Tugu Utara,K o j a
20100622,SDN Tugu Utara 19 Pg.,A,Jl. Kramat Jaya Blok. R Gg.VIII,Tugu Utara,K o j a
20100624,SDN Tugu Utara 21 Pg.,A,Jl. Kr. Jaya Gg.VIII Blok R,Tugu Utara,K o j a
20100625,SDN Tugu Utara 22,A,Jl. Kramat Jaya Komplek Deperla,Tugu Utara,K o j a
20108744,SDN Ujung Menteng 01 Pg.,A,Jl. Irigasi,Ujung Menteng,Cakung
20103479,SDN Ujung Menteng 02,A,"Jl. Irigasi, Ujung Menteng",Ujung Menteng,Cakung
20103478,SDN Ujung Menteng 03 Pg.,A,Jl. Irigasi Ujung Menteng,Ujung Menteng,Cakung
20104195,SDN Ujung Menteng 04 Pg.,A,Jl. Irigasi Ujung Menteng,Ujung Menteng,Cakung
20103476,SDN Ujung Menteng 06 Pt.,A,Jl. Irigasi,Ujung Menteng,Cakung
20103475,SDN Ujung Menteng 07 Pg.,A,Jl. Irigasi Ujung Menteng Rt.01/08,Ujung Menteng,Cakung
20102196,SDN Ulujami 01 Pg.,A,Jl. H. Buang,Ulujami,Pesanggrahan
20102195,SDN Ulujami 02,A,Jl. Swadarma Raya Komp. BNI 46,Ulujami,Pesanggrahan
20102207,SDN Ulujami 04 Pg.,A,Jl. H. ROHIMIN,Ulujami,Pesanggrahan
20106220,SDN Ulujami 05 Pg.,A,Jl. H. Buang,Ulujami,Pesanggrahan
20102208,SDN Ulujami 06 Pg.,A,Jl. Kampung Baru V,Ulujami,Pesanggrahan
20102209,SDN Ulujami 07 Pg.,A,Jl. H. Rohimin,Ulujami,Pesanggrahan
20104477,SDN Untung Jawa 01 Pg.,A,Jl. Pulau Nirwana Rt 002/03,Pulau Untung Jawa,Kepulauan Seribu Selatan
20108378,SDN Utan Kayu Selatan 01 Pg.,A,Jl. Pandan Raya No. I,Utan Kayu Selatan,Matraman
20108379,SDN Utan Kayu Selatan 02 Pt.,B,Jl. Pandan Raya,Utan Kayu Selatan,Matraman
20108380,SDN Utan Kayu Selatan 03 Pg.,A,Jl. Pandan Raya I,Utan Kayu Selatan,Matraman
20108381,SDN Utan Kayu Selatan 04 Pt.,B,Jl. Pandan Raya I,Utan Kayu Selatan,Matraman
20108382,SDN Utan Kayu Selatan 05,A,Jl. Kramat Asem Raya No.64,Utan Kayu Selatan,Matraman
20108414,SDN Utan Kayu Selatan 09 Pg.,B,Jl. Skip Ujung,Utan Kayu Selatan,Matraman
20108416,SDN Utan Kayu Selatan 11 Pg.,B,Jl. Skip Ujung,Utan Kayu Selatan,Matraman
20108418,SDN Utan Kayu Selatan 13 Pg.,A,Jl. Galur Sari Timur,Utan Kayu Selatan,Matraman
20108419,SDN Utan Kayu Selatan 14 Pg.,A,Jl. Galur Sari Timur,Utan Kayu Selatan,Matraman
20103440,SDN Utan Kayu Selatan 16 Pg.,A,Jl. Galur Sari Timur,Utan Kayu Selatan,Matraman
20103439,SDN Utan Kayu Selatan 17 Pg.,A,Jl. Kayu Manis Timur No. 19,Utan Kayu Selatan,Matraman
20103419,SDN Utan Kayu Selatan 18 Pg.,B,Jl. Kelapa Hijau,Utan Kayu Selatan,Matraman
20108421,SDN Utan Kayu Selatan 19 Pt.,A,Jl. Kelapa Hijau,Utan Kayu Selatan,Matraman
20103418,SDN Utan Kayu Selatan 20 Pg.,A,Jl. Galur Sari Timur No. 38,Utan Kayu Selatan,Matraman
20108422,SDN Utan Kayu Selatan 21 Pg.,A,Jl. Galur Sari VIII,Utan Kayu Selatan,Matraman
20103416,SDN Utan Kayu Selatan 23 Pg.,A,Jl. Kramat Asem Raya No. 46,Utan Kayu Selatan,Matraman
20103415,SDN Utan Kayu Selatan 25 Pg.,A,Jl. Galur Sari Timur,Utan Kayu Selatan,Matraman
20109169,SDN Utan Kayu Selatan 27 Pg.,A,Jl. Skip Ujung,Utan Kayu Selatan,Matraman
20108844,SDN Utan Kayu Utara 01 Pg.,B,Jl. Utan Kayu Utara No. 107,Utan Kayu Utara,Matraman
20108411,SDN Utan Kayu Utara 07 Pg.,B,Jl. Galur Sari,Utan Kayu Utara,Matraman
20108848,SDN Utan Kayu Utara 08 Pg.,B,Jl. Galur Sari,Utan Kayu Utara,Matraman
20108849,SDN Utan Kayu Utara 11 Pg.,B,Jl. Balai Rakyat Raya No. 11,Utan Kayu Utara,Matraman
20104707,SDN Utan Panjang 01 Pg.,B,Jl. Bendungan Jago,Utan Panjang,Kemayoran
20104709,SDN Utan Panjang 03 Pg.,A,Jl. Bendungan Jago,Utan Panjang,Kemayoran
20104965,SDN Warakas 01 Pg.,A,Jl. Warakas Gg. VII No.104,Warakas,Tanjung Priok
20104966,SDN Warakas 02 Pt.,A,Jl. Warakas VII Gg.8 No.104,Warakas,Tanjung Priok
20104967,SDN Warakas 03 Pg.,A,Jl. Warakas I Gg. 20,Warakas,Tanjung Priok
20104968,SDN Warakas 04 Pt.,A,Jl. Warakas I Gg. 20 No. 1,Warakas,Tanjung Priok
20104969,SDN Warakas 05 Pg.,A,Jl. Warakas I Gg. 20,Warakas,Tanjung Priok
20104970,SDN Warakas 06 Pt.,A,Jl. Warakas I Gg. 20,Warakas,Tanjung Priok
20104971,SDN Warakas 07 Pg.,B,Jl. Warakas I Gg. 20,Warakas,Tanjung Priok
20105590,SDN Wijaya Kusuma 01 Pg.,A,Jl. Perdana Raya No. 7,Wijaya Kusuma,Grogol Petamburan
20105591,SDN Wijaya Kusuma 02 Pg.,A,Jl. Wijaya Taman Duta Mas Blok F4,Wijaya Kusuma,Grogol Petamburan
20105592,SDN Wijaya Kusuma 03 Pg.,B,Jl. Perdana Raya No. 7,Wijaya Kusuma,Grogol Petamburan
20105594,SDN Wijaya Kusuma 05 Pg.,A,Jl. Karya,Wijaya Kusuma,Grogol Petamburan
20105596,SDN Wijaya Kusuma 07 Pg.,A,Jl. Karya I,Wijaya Kusuma,Grogol Petamburan
20104641,SDNP Menteng 02 Pg.,A,Jl. Tegal No. 10,Menteng,Menteng
20104642,SDNP Menteng 03 Pg.,A,Jl. Cilacap No. 5,Menteng,Menteng
20102735,SDS 17 Agustus Tauladan,A,Jl. Tebet Dalam IV,Tebet Barat,T e b e t
20109346,SDS 6 BPK Penabur,A,Jl. Hibrida Raya Blok QA 3,Kelapa Gading Barat,Kelapa Gading
20110109,SDS ABC,Tidak Terakreditasi,JL Danau Sunter Utara Blok C No 28-29 Ruko Terace,Papanggo,Tanjung Priok
20109317,SDS Abdi Siswa,A,Taman Aries Blok E9 No.1,Meruya Utara,Kembangan
20102736,SDS Adik Irma,A,"Jl.Tebet Barat IV Rawa Bilal,Tebet Barat",Tebet Barat,T e b e t
20104974,SDS Advent Anggrek,B,Jl. Anggrek No. 17,Rawa Badak Utara,K o j a
20103871,SDS Advent Ciracas,A,Jl. Raya Bogor Km. 26 No. 15,Ciracas,Ciracas
20104711,SDS Advent I Kramat,A,Jl. Kramat Pulo No. 16,Kramat,S e n e n
20104713,SDS Advent IV Benhil,B,Jl. Bend. Jatiluhur 62,Bendungan Hilir,Tanah Abang
20104975,SDS Advent IX Tg. Priok,B,Jl. Kramat Jaya Blok C No.15,Semper Barat,Cilincing
20109442,SDS Advent Menteng,A,Jl. Sawo No. 27,Gondangdia,Menteng
20109227,SDS Advent VII,B,Jl. Pinang No. 24,Rawamangun,Pulo Gadung
20104976,SDS Aisyiyah,B,Jl. Seroja No. 2,Rawa Badak Utara,K o j a
20108969,SDS Al Abidin,A,Jl. H. Hanafi,Pondok Bambu,Duren Sawit
20109209,SDS Al Akhyar,B,Jl. Al-Akhyar Kayu Tinggi,Cakung Timur,Cakung
20105600,SDS Al Azhar,A,Jl. H. Saaba Komp. Unilever,Meruya Selatan,Kembangan
20106226,SDS Al Azhar,A,Jl. Jagakarsa Raya No. 16,Jagakarsa,Jagakarsa
20109092,SDS Al Azhar 13 Rawamangun,A,Jl. Sunan Giri No. 1,Rawamangun,Pulo Gadung
20108867,SDS Al Azhar 20,A,Jl. Abdul Rahman No. 9,Cibubur,Ciracas
20103081,SDS Al Azhar II,A,Jl. Mujair I No. 63,Pasar Minggu,Pasar Minggu
20104977,SDS Al Azhar Kelapa Gading,A,Jl. Raya Boulevard Timur Kelapa Gading,Pegangsaan Dua,Kelapa Gading
20108876,SDS Al Aziz,B,Jl. Raya Penggilingan,Penggilingan,Cakung
20104715,SDS Al Badar,B,Jl. Menteng Sukabumi IV/ 75,Menteng,Menteng
20108438,SDS Al Barra,B,Jalan Pengayoman III no 44,Utan Kayu Utara,Matraman
20106228,SDS Al Bayinah,A,Jl. R. M. Moh. Kahfi II No. 78,Cipedak,Jagakarsa
,SDS Al Falah Kalibata City,Tidak Terakreditasi,"Kalibata City Tower Jasmine, Jl. TMP Kalibata Raya",Rawajati,Pancoran
20106229,SDS Al Hidayah,B,Jl. Srengseng Sawah No. 74,Srengseng Sawah,Jagakarsa
20106230,SDS Al Hidayah I,A,Jl. Cilandak KKO No.70,Cilandak Timur,Pasar Minggu
20106231,SDS Al Hidayah II,A,Jl. Cilandak KKO No. 70,Cilandak Timur,Pasar Minggu
20106232,SDS Al Hikmah,A,Jl. Bangka II No. 24,Pela Mampang,Mampang Prapatan
,SDS Al Hikmatuzzainiyah,Tidak Terakreditasi,Jl. Satria III,Ujung Menteng,Cakung
20104979,SDS Al Husna,B,Jl. Enggano No. 1,Tanjung Priok,Tanjung Priok
20103093,SDS Al ihsan,A,Jl. Baung IV No.43,Kebagusan,Pasar Minggu
20103795,SDS Al Ikhlash,B,Jl. Dewi Sartika No. 200,Cawang,Kramat Jati
20105599,SDS Al Kamal,A,Jl.Raya Kedoya No. 2,Kedoya Selatan,Kebon Jeruk
20103923,SDS Al Qudwah,B,Jl. Kayu Tinggi No. 58,Cakung Timur,Cakung
20103945,SDS Al Wathoniyah 9,A,Jl. Raya Penggilingan No. 99,Penggilingan,Cakung
20104718,SDS Al-Abrar,B,Jl. Bendungan Hilir Raya No. 148,Bendungan Hilir,Tanah Abang
20104980,SDS Al-Amanah,A,Jl. Sunter Karya Selatan IV Blok H,Sunter Agung,Tanjung Priok
20106237,SDS Al-Azhar FKL IV,A,Jl. Ciputat Raya No. 5A,Kebayoran Lama Selatan,Kebayoran Lama
20106238,SDS Al-Azhar Kemandoran,A,Jl. Kemandoran I No. 41,Grogol Utara,Kebayoran Lama
20106239,SDS Al-Azhar Kemang,A,Jl. Kemang Raya No. 7,Bangka,Mampang Prapatan
20106240,SDS Al-Fakhiriyah,A,Jl. Rancho Indah No. 47,Tanjung Barat,Jagakarsa
20103816,SDS Al-Falah,A,Jl. Kelapa Dua Wetan No. 4,Kelapa Dua Wetan,Ciracas
20109133,SDS Al-Falah 01 Pt.,A,Jl. Al-Falah Raya No.52,Sukabumi Selatan,Kebon Jeruk
20105602,SDS Al-Falah 02 Pg.,A,Jl. Pos Pengumben No. 18,Sukabumi Selatan,Kebon Jeruk
20105601,SDS Al-Falah I Pg.,A,Jl. Kampung Baru Rt.009/03,Sukabumi Selatan,Kebon Jeruk
20106241,SDS Al-Falah III Pt.,A,Jln. Pos Pengumben No.18,Sukabumi Selatan,Kebon Jeruk
20108868,SDS Al-Fathiyah,B,Jl. Pucung No. 14 A,Balekambang,Kramat Jati
20106242,SDS Al-Furqon,A,Jl. Seha II No. 14,Grogol Selatan,Kebayoran Lama
20105603,SDS Al-Hasanah,A,Jl. Daud I Rt.001/08 No.15,Sukabumi Utara,Kebon Jeruk
20103893,SDS Al-Hayati Diniyah,B,Jl. Masjid Al Muqarrobin,Cipinang Melayu,Makasar
20108970,SDS Al-Humaid,B,Jl. Pahlawan Revolusi No. 1,Pondok Bambu,Duren Sawit
20105604,SDS Al-Huriah,Tidak Terakreditasi,Jl. Tiang Bendera II No.120 AA,Roa Malaka,Tambora
20105605,SDS Al-Ihsan,A,Jl. Raya Masjid Al-Ihsan,Meruya Utara,Kembangan
20100884,SDS Al-Ikhlas,B,Jl. IV D.I No. 26,Lagoa,K o j a
20106244,SDS Al-Ikhlas,A,Jl. Kemandoran II No. 28,Grogol Utara,Kebayoran Lama
20104982,SDS Al-Ikhwan,B,Jl. Karang Kendal No. 21,Marunda,Cilincing
20100446,SDS Al-Irsyad (PAAP),C,Jl. K.H. Hasyim Asyhari,Petojo Utara,Gambir
20104983,SDS Al-Islamiyah,B,Jl. Kalibaru Timur Rt.15/03,Kalibaru,Cilincing
20105606,SDS Al-Isro,B,Jl. Tanjung Duren Raya No 1,Tanjung Duren Utara,Grogol Petamburan
20106245,SDS Al-Ittihad,B,Jl. Kemandoran I Pulo Mawar,Grogol Utara,Kebayoran Lama
20104721,SDS Al-Ittihadiyah,B,Jl. Tanah Tinggi IV Gg. V,Tanah Tinggi,Johar Baru
20106246,SDS Al-Izhar,A,Jl. R.S. Fatmawati Kav. 49,Pondok Labu,Cilandak
20108870,SDS Al-Kahfi,A,Jl. H. Muhayang no.39 C,Rambutan,Ciracas
20104985,SDS Al-Khairiyah Pt.,B,Jl. Mindi No. 2,Lagoa,K o j a
20104722,SDS Al-Marhamah,B,Jl. Angkasa Dalam II/52,Gunung Sahari Selatan,Kemayoran
20104099,SDS Al-Ma'ruf,A,Jl. Raya Lapangan Tembak - Cibubur,Kelapa Dua Wetan,Ciracas
20105612,SDS Almasih,A,Jl. Wijaya V E 1/ 1,Wijaya Kusuma,Grogol Petamburan
20109310,SDS Al-Mukhlisin,A,Jl. Belimbing Raya Bojong Indah,Rawa Buaya,Cengkareng
20109413,SDS Al-Mukhlisin,B,Jl. Pedongkelan No. 46,Kapuk,Cengkareng
20108861,SDS Al-Musanifiah,B,Jl. Delima Raya No. 29,Pondok Kelapa,Duren Sawit
20105609,SDS Al-Muttaqin,B,Jl. Kerajinan Kebon Sayur III,Keagungan,Taman Sari
20105610,SDS Al-Qomar,A,Jl. Kamal Raya No. 1,Tegal Alur,Kalideres
20104840,SDS Alwathoniyah 43,A,Jl. Rorotan I Nomor:10,Rorotan,Cilincing
20109059,SDS Amaryllis,A,Jl. Abdul Rahman No. 7,Cibubur,Ciracas
20104723,SDS Amir Hamzah,B,JLN. TAMAN MATRAMAN TIMUR NO. 34 A,Pegangsaan,Menteng
20105613,SDS Amitayus,A,Jl. Seni Budaya Raya No. 1,Jelambar Baru,Grogol Petamburan
69755635,SDS Ananda Islamic School,A,Jl Tanjung Pura No. 34 (Dpn Gerbang Barat citra 2),Pegadungan,Kalideres
,SDS Ananda Mulya,Tidak Terakreditasi,Jl. Agung Tengah 6 Blok I-4 No. 2,Sunter Agung,Tanjung Priok
20105614,SDS Angela,A,Jl. Perumahan Interkota Indah Blok C1/19,Duri Kosambi,Cengkareng
20108786,SDS Angkasa 1,A,Jl. Raya Rajawali,Halim Perdana Kusumah,Makasar
20103914,SDS Angkasa 10,A,Jl. Cendrawasih Komplek Rajawali,Halim Perdana Kusumah,Makasar
20103913,SDS Angkasa 12,A,Jl. Gatot Kaca Dirgantara II,Halim Perdana Kusumah,Makasar
20103919,SDS Angkasa 3,A,Jl. Mustang Komp. Skadron,Halim Perdana Kusumah,Makasar
20103918,SDS Angkasa 4,A,Jl. Gatot Kaca Dirgantara II,Halim Perdana Kusumah,Makasar
20103917,SDS Angkasa 5,A,Jl. Marsma Hardadi MS. Halim Perdanakusuma,Halim Perdana Kusumah,Makasar
20103916,SDS Angkasa 7,A,Jl. Kayatun Komp. Trikora,Halim Perdana Kusumah,Makasar
