npsn,nama_sekolah,akreditasi,alamat,kelurahan,kecamatan
20109254,SMK Bakti Idhata,A,Jl. Melati No. 25,Cilandak Barat,Cilandak
20107410,SMK Barunawati,A,Jl. Ganggeng II No. 1,Sungai Bambu,Tanjung Priok
20103271,SMK Berlian Jakarta,B,Jl. Berlian No. 9A,Bidara Cina,Jatinegara
20100132,SMK Bethel,B,Jl. KS. Tubun No. 253,Petamburan,Tanah Abang
20101596,SMK Bhakti,C,Jl. Karya Barat I Ujung No.24 Jakarta Barat,Wijaya Kusuma,Grogol Petamburan
20103270,SMK Bhakti - 1 Jakarta,A,Jl. Perindustrian No. 7,Kebon Pala,Makasar
20103269,SMK Bhakti - 2 Jakarta,A,Jl. Perindustrian No. 7,Kebon Pala,Makasar
20103505,SMK Bhakti 3,Tidak Terakreditasi,Jl. Kalimalang No.40A,Pondok Bambu,Duren Sawit
20107266,SMK Bhakti Pertiwi Jakarta,B,Jl. Bekasi Timur VI Cipinang Besar Utara,Bali Mester,Jatinegara
20101595,SMK Bhara Trikora 1,A,Jl. Kav. POLRI Blok F,Jelambar,Grogol Petamburan
20101593,SMK Bhineka Tunggal Ika,A,Jl. KH. Moh Mansyur No. 222A,Tanah Sareal,Tambora
20108796,SMK Bina Bangsa,Tidak Terakreditasi,Jl. Tanjung Pura V,Pegadungan,Kalideres
69856220,SMK BINA CITRA ASIA,B,JL. Al-Amin No. 1,Kramat Jati,Kramat Jati
20100133,SMK Bina Darma DKI,A,Jl. Abdul Rahman Saleh I No. 10/A Senen,Senen,S e n e n
20103267,SMK Bina Dharma,A,Jl. Raya Ciracas No. 39,Ciracas,Ciracas
20101578,SMK Bina Insan Mandiri Jakarta,A,Jl. Meruya Ilir Komp. Qaryah Thayyibah Blok A,Srengseng,Kembangan
20101687,SMK Bina Karya,A,Jl. KH. Moh. Mansyur No. 19-25,Kredang,Tambora
20107204,SMK Bina Karya Utama Jakarta,B,Jl. Raya Bekasi Km. 26,Ujung Menteng,Cakung
20102533,SMK Bina Kusuma 1 Jakarta,B,Jl. Merpati Raya No. 38,Pesanggrahan,Pesanggrahan
20103266,SMK Bina Manajemen,B,Jl. Dr. KRT. Radjiman Widyodiningrat,Rawa Terate,Cakung
20109304,SMK Bina Medika,A,Jl. As-Syafi'iyah No.121,Cilangkap,Cipayung
69873590,SMK Bina Nusa Mandiri,Tidak Terakreditasi,Jl. Raya Ciracas No. 1,Ciracas,Ciracas
20107593,SMK Bina Pangudi Luhur,A,Jl. Kramat Asem Raya No. 54,Utan Kayu Selatan,Matraman
20103265,SMK Bina Pembangunan I,B,Jl. Kayu Putih Selatan IV No. 44,Pulo Gadung,Pulo Gadung
20112511,SMK Bina Prestasi,B,Jl. Raya Condet No. 28,Batu Ampar,Kramat Jati
20102530,SMK Bina Putra Jakarta,A,Jl. Kemang Timur Raya No. 50,Bangka,Mampang Prapatan
20177823,SMK Bintang Nusantara,Tidak Terakreditasi,Jl. Sarang Bangau No.27,Marunda,Cilincing
20103263,SMK Bisnis Indonesia Jakarta,A,Jl. Irigasi Raya (Menteng Metropolitan),Ujung Menteng,Cakung
20106934,SMK BKUI (Al Kautsar),A,Jl. Jembatan Selatan No. 6,Pulo,Kebayoran Baru
20102544,SMK Borobudur 1 Jakarta,A,Jl. Raya Cilandak KKO,Cilandak Timur,Pasar Minggu
20102545,SMK Borobudur 2 Jakarta,B,Jl. Raya Cilandak KKO,Cilandak Timur,Pasar Minggu
20112290,SMK Boss Multimedia,Tidak Terakreditasi,Jl. Raya Buaran No 1,Pulo Gadung,Pulo Gadung
20103262,SMK BPS&K 1 Jakarta,A,Jl. Bina Karya No. 2,Pondok Kopi,Duren Sawit
20103242,SMK BPS&K 2 Jakarta,A,Jl. Bina Karya No. 2,Pondok Kopi,Duren Sawit
20103696,SMK Budaya Jakarta,A,Jl. Dermaga Baru No. 48,Klender,Duren Sawit
20103694,SMK Budhaya 2 St. Agustinus,B,Jl.Raya Radin Inten II Buaran,Cipinang,Pulo Gadung
20103692,SMK Budhi Warman 1 Jakarta,A,Jl. Raya Bogor Km. 19,Kramat Jati,Kramat Jati
20103691,SMK Budhi Warman 2 Jakarta,A,Jl. Raya Bogor Km. 28,Pekayon,Pasar Rebo
20102559,SMK Budi Asih,A,Jl. Bukit Tinggi No. 3,Pasar Manggis,Setia Budi
20103687,SMK Budi Mulia Utama,A,Jl. Rawa Jaya No. 35,Pondok Kopi,Duren Sawit
20103686,SMK Budi Murni 1 Jakarta,B,Jl. Sawah Barat,Duren Sawit,Duren Sawit
20101670,SMK Budi Murni 2,A,Jl. Puri Kembangan No. 2,Kedoya Selatan,Kebon Jeruk
20103684,SMK Budi Murni 3 Jakarta,A,Jl. Sawah Barat,Duren Sawit,Duren Sawit
20103683,SMK Budi Murni 4 Jakarta,A,Jl. Budi Murni No. 10,Cipayung,Cipayung
20103682,SMK Budi Murni 5 Jakarta,B,Jl. Budi Murni no. 10,Cilangkap,Cipayung
20102557,SMK Bunda Kandung Jakarta,A,Jl. Palapa Raya No. 3,Pasar Minggu,Pasar Minggu
20107252,SMK Bunda Mulia 1,A,Jl. AM. Sangaji No. 20 Jakarta Pusat,Petojo Utara,Gambir
20101668,SMK Bunga Nusa I,A,"Jl. Rawa Bengkel Sdn 19 Pagi, Cengkareng Barat",Cengkareng Barat,Cengkareng
20103698,SMK Cagar Budaya 1 Jakarta,B,Jl. Raya Hankam TMII. Gempol No.47,Bambu Apus,Cipayung
20103715,SMK Cahaya Sakti Jakarta,A,Jl. Otista 1 No. 11,Bali Mester,Jatinegara
20104453,SMK Candra Naya,A,Jl. Jembatan Besi II / 26,Jembatan Besi,Tambora
20103769,SMK Caraka Nusantara,A,Kompleks Pulo Gebang Permai Blok H 4 No. 10,Pulo Gebang,Cakung
20103712,SMK Cawang Jakarta,B,Jl. Cawang Baru No. 71,Cipinang Cempedak,Jatinegara
20178283,SMK Cempaka,B,Jl. Cempaka Putih Barat1,Cempaka Putih Barat,Cempaka Putih
20101581,SMK Cengkareng 1 Jakarta,A,Jl. Bambu Larangan No. 67,Cengkareng Barat,Cengkareng
69764515,SMK Cengkareng 2,A,Jl. Kawasan Rumah Susun Perumnas No. 2,Cengkareng Timur,Cengkareng
20101665,SMK Cengkareng Jakarta,B,Jl. Peta Selatan No. 53 Kalideres,Pegadungan,Kalideres
20103711,SMK Cikra 1 Jakarta,B,Jl. Cipinang Kebembem V/32,Pisangan Timur,Pulo Gadung
20107412,SMK Cilincing 1 Jakarta,B,Jl. Baru Gang II,Cilincing,Cilincing
20107413,SMK Cilincing 3 Jakarta,B,Jl. Kebantenan IV No. 26,Semper Timur,Cilincing
20101662,SMK Cindera Mata Indah Jakarta,B,Jl. Duri Raya (TSS) Gg. Budi No. 86,Duri Utara,Tambora
20104454,SMK Cinta Kasih Tzu Chi,A,Jl. Kamal Raya No. 20 Outer Ringroad,Cengkareng Timur,Cengkareng
20103709,SMK Cipta Karya,B,Jl. Kayu Manis Timur No. 52D,Kayu Manis,Matraman
20103708,SMK Citra Dharma Jakarta,C,Jl. Swadaya I,Bambu Apus,Cipayung
20107206,SMK Citra Mandiri,A,Jl. Pahlawan Komaruddin Ujung Krawang,Pulo Gebang,Cakung
69774556,SMK Citra Utama,Tidak Terakreditasi,Jl. Lingkungan III,Tegal Alur,Kalideres
20103707,SMK Corpatarin 01,A,Jl. Raya Pondok Kopi,Pondok Kopi,Duren Sawit
20103706,SMK Corpatarin 2 Jakarta,A,Jl. Pondok Kopi Raya No. 87,Pondok Kopi,Duren Sawit
20109265,SMK Cyber Media,A,Jl. Duren Tiga No. 12,Duren Tiga,Pancoran
20102553,SMK DAARUL ULUUM,A,Jl. Pedurenan Raya No. 53,Karet Kuningan,Setia Budi
20107414,SMK Darul Ma'arif,B,Jl. Madya Kebantenan No. 14,Semper Timur,Cilincing
20102552,SMK Darussalam Jakarta,A,Jl. M. Kahfi II No. 28,Srengseng Sawah,Jagakarsa
20102551,SMK Desa Putera,A,Jl. Desa Putera No.1,Srengseng Sawah,Jagakarsa
20101661,SMK Dewi Sartika,A,Jl. Tanjung Duren Barat 1,Duri Kepa,Kebon Jeruk
69759304,SMK Dewi Sartika,A,Jl. Kebon Nanas Utara II/23,Cipinang Cempedak,Jatinegara
20101660,SMK Dhamma Savana Jakarta,A,Jl. Padamulya VI No. 176 B,Angke,Tambora
20100136,SMK Dharma Bhakti,B,Jl. Mardani Raya No.7,Cempaka Putih Timur,Cempaka Putih
20107415,"SMK Dharma Budhi Bhakti ""Plus""",A,Jl. Agung Tengah 7 Blok I-6 No. 1,Sunter Agung,Tanjung Priok
20102550,SMK Dharma Karya,A,Jl. Melawai XII/207,Melawai,Kebayoran Baru
20107207,SMK Dharma Paramitha,B,Jl. Sultan Hamengkubuwono IX,Ujung Menteng,Cakung
20107416,SMK Dharma Putra,B,Jl. Swasembada Barat XI No.92,Kebon Bawang,Tanjung Priok
20109505,SMK Dharma Putra 2,B,Jl. Swasembada Barat XI No.92,Kebon Bawang,Tanjung Priok
20103704,SMK Dharma Surya,B,Jl. Pangkalan Jati IV No. 47,Cipinang Melayu,Makasar
20101673,SMK Dian Jakarta,B,"Jl. Pedongkelan Belakang No. 128, Kapuk",Kapuk,Cengkareng
20112446,SMK Didaktika,B,Jl. Pulo Harapan Indah,Cengkareng Barat,Cengkareng
20103703,SMK Dinamika Pembangunan 1 Jakarta,A,Jl. Raya Penggilingan No. 99,Penggilingan,Cakung
20103702,SMK Dinamika Pembangunan 2 Jakarta,A,Jl. Raya Penggilian No. 99,Penggilingan,Cakung
20103701,SMK Diponegoro 1 Jakarta,A,Jl. Sunan Giri 5,Rawamangun,Pulo Gadung
20103700,SMK Diponegoro 2,B,Jl. Kayu Tinggi,Cakung Timur,Cakung
20101674,SMK Duta Bangsa,B,Jl. Kapuk Raya Gg. Masjid No. 71,Kapuk,Cengkareng
20101674,SMK Duta Bangsa Jakarta,B,"Jl. Kapuk Raya No. 71, Kapuk",Kapuk,Cengkareng
20101686,SMK Duta Mas Jakarta,B,"Jl. Wijaya No. VIII/9, Komp. Taman Duta Mas",Wijaya Kusuma,Grogol Petamburan
20100138,SMK Dwikora 1 Jakarta,C,Jl. Kramat Pulo II Gandul,Tanah Tinggi,Johar Baru
20100137,SMK Dwikora 2 Jakarta,C,Jl. Kramat Pulo II Gandul,Tanah Tinggi,Johar Baru
20103657,SMK Eka Paksi Jakarta,B,Jl. Mualim Aminudin,Cibubur,Ciracas
20101685,SMK Eka Sakti,B,"Jl. Ukir Raya No. 30 A, Cengkareng",Cengkareng Timur,Cengkareng
20104455,SMK Era Pembangunan,A,Jl. Gaga Alas Tua No.122,Semanan,Kalideres
20103656,SMK Era Pembangunan Umat Jakarta,B,Jl. Usman No. 71,Ciracas,Ciracas
20107417,SMK Fajar Indah,A,Jl. Waspada Raya I/30,Pademangan Barat,Pademangan
20109547,SMK Farmasi Bhumi Husada,A,"Jl. Raya Fatmawati No 7, Cilandak, Jak-Sel",Lebak Bulus,Cilandak
20107254,SMK Farmasi DITKESAD,A,Jl. Abdulrahman Saleh no 18,Senen,S e n e n
20109934,SMK Farmasi IKIFA,A,Jl. Buaran II No. 30A- I Gusti Ngurah Rai,Klender,Duren Sawit
20107350,SMK Farmasi LPK,B,Raya Lenteng Agung No. 33,Kebagusan,Pasar Minggu
20109314,SMK Farmasi Penabur,A,Jl. Pintu Air Raya No. 11 Jakarta Pusat,Pasar Baru,Sawah Besar
20109329,SMK Farmasi Rawasari,Tidak Terakreditasi,Jl. Letjend Soeprapto No. 22,Johar Baru,Johar Baru
20107255,SMK Farmasi Tunas Bangsa,A,Jl. Salemba Tengah II / 1,Paseban,S e n e n
20102548,SMK Fatahillah,B,Jl. Ciputat Raya No. 5,Pondok Pinang,Kebayoran Lama
20103655,SMK Fensensius Jakarta,B,Jl. Taman. Pulo Asem Utara 60,Pulo Gadung,Pulo Gadung
20103561,SMK Fransiskus 1 Jakarta,A,Jl. Bangunan Barat No. 29,Kayu Putih,Pulo Gadung
20107209,SMK Garuda,B,Jl. Raya Bekasi,Jatinegara Kaum,Pulo Gadung
20107210,SMK Gema Nusantara,B,JL. DUA SEMBILAN NO.18,Duren Sawit,Duren Sawit
20102547,SMK Gita Kirti 1 Jakarta,A,Jl. BRI Radio Dalam,Gandaria Utara,Kebayoran Baru
20107418,SMK Gita Kirti 2 Jakarta,A,Jl. Sunter Jaya No. 4,Sunter Jaya,Tanjung Priok
20178278,SMK Gita Wisata,B,Jl. Raya Bekasi Km. 26,Ujung Menteng,Cakung
20107419,SMK Global 21 Jakarta,Tidak Terakreditasi,Jl. Lanji No. 2 RT.004/RW.006,Papanggo,Tanjung Priok
69829196,SMK Global Cendekia,Tidak Terakreditasi,Jl. Raya Bekasi KM. 23,Cakung Barat,Cakung
,SMK Global Persada,C,Jl. Raya Kembangan Utara No. 14,Kembangan Utara,Kembangan
20102529,SMK Grafika Yayasan Lektur,A,Jl. Pasar Jumat,Lebak Bulus,Cilandak
20107420,SMK Gunung Jati Jakarta,A,Jl. Sungai Bambu IV No. 35,Sungai Bambu,Tanjung Priok
20103652,SMK Gutama Jakarta,B,Jl. Permata No. 17,Kebon Pala,Makasar
20107409,SMK Hang Tuah 2,A,"Jl. Perintis Kemerdekaan, Komp TNI-AL",Kelapa Gading Barat,Kelapa Gading
20107421,SMK Hang Tuah I Jakarta,A,Jl. Tabah Raya Komp. TNI AL,Kelapa Gading Barat,Kelapa Gading
20103649,SMK Harapan 1 Jakarta,B,Jl. I Gusti Ngurah Rai,Penggilingan,Cakung
20101682,SMK Harapan Jaya,B,"Jl. Daan Mogot Km 13, Cengkareng Timur",Cengkareng Timur,Cengkareng
20101681,SMK Harapan Raya,B,Jl. Kapuk Raya Gg. Sinar 5,Kapuk,Cengkareng
20109247,SMK Harnasto Institut,B,Jl. Cidodol Raya No. 40,Grogol Selatan,Kebayoran Lama
20101680,SMK Harvard Jakarta,B,Jl. P. TB. Angke No. 33,Angke,Tambora
20103647,SMK Hatawana Jakarta,B,Jl. Cipinang Besar Selatan No. 1,Cipinang Besar Selatan,Jatinegara
20102635,SMK Hidatha Jakarta,B,Jl. Cilandak Tengah III/53,Cilandak Barat,Cilandak
20101679,SMK Ibu Pertiwi 1 Jakarta,A,Jl. Let. Jend. S. Parman No. 69,Slipi,Palmerah
20101677,SMK Ibu Pertiwi 2 Jakarta,B,Jl. S. Parman No. 69,Slipi,Palmerah
20103645,SMK Imtaq Darurrahim,B,"Jl. TiparCakung, Gang Pelajar",Cakung Barat,Cakung
20109266,SMK Informatika Yasma,A,Jl. Jeruk Purut No 10,Cilandak Timur,Pasar Minggu
11298527,SMK Insan Aqilah 4 Jakarta,Tidak Terakreditasi,Jl. Penerangan No. IA,Wijaya Kusuma,Grogol Petamburan
20177897,SMK Insan Cita,B,Jl. Daan Mogot Raya KM 18 No. 28,Kalideres,Kalideres
NP637129,SMK Insan Mandiri Jakarta,Tidak Terakreditasi,Jl. Moch Kahfi II NO.48,Jagakarsa,Jagakarsa
69775769,SMK Insan Mulia Informatika,C,Jl. Kapuk,Bambu Apus,Cipayung
20103643,SMK Insan Teknologi Jakarta,A,Jl. Cibubur IV No. 29,Cibubur,Ciracas
20101675,SMK IP. Yakin,B,"Jl. Bangun Nusa No. 10, Cengkareng",Cengkareng Timur,Cengkareng
20103642,SMK IPTEK Jakarta,A,Jl. Raya Pulo Gebang No 99,Pulo Gebang,Cakung
20101641,SMK Islam A.A,A,Jl. Tanjung Duren Dalam IV/25,Tanjung Duren Selatan,Grogol Petamburan
20102634,SMK Islam Al Hikmah,A,Jl. Kemajuan No. 48-55,Petukangan Selatan,Pesanggrahan
,SMK Islam Al Makiyyah,B,Jl. Raya Pondok Gede Gg.Gorda I No. 17,Lubang Buaya,Cipayung
20102633,SMK Islam Al-Ihsan Jakarta,B,Jl. Raya Pesanggrahan No. 1,Pesanggrahan,Pesanggrahan
20102439,SMK Islam Andalus,B,Jl. Bangka II F No. 32,Pela Mampang,Mampang Prapatan
20101658,SMK Islam Bahagia,B,Jl. Pesima Raya No.15,Kalianyar,Tambora
20107272,SMK Islam Fatahillah Jakarta,A,Jl. Keutamaan No. 89,Krukut,Taman Sari
20103658,SMK Islam Malahayati Jakarta,A,Jl. Bima No. 3,Cijantung,Pasar Rebo
20103659,SMK Islam PB Soedirman 1 Jakarta,A,Jl. Raya Bogor Km. 24,Cijantung,Pasar Rebo
20103660,SMK Islam PB Soedirman 2 Jakarta,A,Jl. Raya Bogor Km. 24 Cijantung,Cijantung,Pasar Rebo
20101642,SMK Islam Perti Jakarta,A,Jl. Tawakal Raya No. 99,Tomang,Grogol Petamburan
20102629,SMK Islam Wijaya Kusuma,A,Jl. Raya Lenteng Agung,Lenteng Agung,Jagakarsa
20103677,SMK Islam Yasmin Jakarta,B,Jl. Raya Bogor Km. 27,Pekayon,Pasar Rebo
20102628,SMK Islam YPIK Jakarta,A,Jl. Srengseng Sawah Sawah No.87,Srengseng Sawah,Jagakarsa
20102627,SMK Islam YPS Jakarta,A,Jl. Raya Lenteng Agung,Lenteng Agung,Jagakarsa
20101640,SMK Jakarta 1,A,Jl. Peta Selatan No. 24,Kalideres,Kalideres
20103676,SMK Jakarta 1,A,Jl. Raya Pondok Kopi No. 75,Pondok Kopi,Duren Sawit
20100117,SMK Jakarta Dua,B,Jl. Cempaka Baru Tengah 1-3,Cempaka Baru,Kemayoran
20101639,SMK Jakarta III,B,Jl. Kedoya Raya No. 200,Kedoya Selatan,Kebon Jeruk
20101638,SMK Jakarta IV,B,Jl. Kedoya Selatan No. 200,Kedoya Selatan,Kebon Jeruk
20102626,SMK Jakarta Manajemen,B,Jl. Praja Dalam No. E/3,Kebayoran Lama Selatan,Kebayoran Lama
20100108,SMK Jakarta Pusat 1,A,Jl. Abdul Muis No. 44,Petojo Selatan,Gambir
20103675,SMK Jakarta Raya 1,B,Jl. Raya Pondok Gede No. 36,Lubang Buaya,Cipayung
20103674,SMK Jakarta Raya 2,B,Jl. Raya Pondok Gede No. 36,Lubang Buaya,Cipayung
20103672,SMK Jakarta Timur 1,B,Jl. Cawang Baru No. 543,Cipinang Cempedak,Jatinegara
20103671,SMK Jakarta Timur 2,A,Jl. Cempaka VI Kayu Tinggi Nomor 7C,Cakung Timur,Cakung
20107352,SMK Jakarta Wisata,A,Jl. Praja Dalam E No. 3,Kebayoran Lama Selatan,Kebayoran Lama
20107423,SMK Jalasena,A,Jl. Sarang Bango No.27,Semper Timur,Cilincing
20100775,SMK Jaya Jakarta,A,Jl. Perintis Kemerdekaan,Kelapa Gading Barat,Kelapa Gading
20108510,SMK Jaya Wisata 1 Jakarta,A,Jl. Taman Sunda Kelapa No. 16 A,Menteng,Menteng
20103668,SMK Jayakarta,B,Jl. Bunga Rampai XI/1 No. 47,Malaka Jaya,Duren Sawit
20103667,SMK Jayawisata 2 Jakarta,A,Jl. Pangkalan Jati II No. 19,Cipinang Melayu,Makasar
20101637,SMK Josua Jakarta,B,Jl. Kotabambu Utara 2 No. 8,Kota Bambu Utara,Palmerah
20101636,SMK K Pancaran Berkat,A,Jl. Setia Jaya Raya No. 100,Jelambar,Grogol Petamburan
20107428,SMK K. Harapan Mulia,B,Jl. Pademangan Timur V Ujung Blok D,Pademangan Timur,Pademangan
20101652,SMK K. Rahmani,B,Jl. Mangga Besar R. Tangki,Tangki,Taman Sari
20178281,SMK Kafah Unggul 2 Jakarta,B,Jl. Jembatan Besi No. 12,Jembatan Besi,Tambora
20102546,SMK Kahuripan 1,B,Jl. Nangka No. 17,Tanjung Barat,Jagakarsa
20107351,SMK Kahuripan 2,B,Jl. Nangka No. 17,Tanjung Barat,Jagakarsa
20103664,SMK Kalpataru,A,Jl. Raya Tipar Cakung,Cakung Barat,Cakung
20100105,SMK Kampung Jawa Jakarta,B,Jl. Percetakan Negara 2,Johar Baru,Johar Baru
20103663,SMK KAPIN,A,Jl. Raya Kalimalang,Pondok Kelapa,Duren Sawit
20177894,SMK Kapin 2,B,Jl. Raya Kalimalang,Pondok Kelapa,Duren Sawit
20101634,SMK Kartika X-1,A,Jl. Daan Mogot Km. 17,Kalideres,Kalideres
20107353,SMK Kartika X-2,A,Jl. Anggrek No. 1,Pesanggrahan,Pesanggrahan
20100104,SMK Kartini 1 Jakarta,A,Jl. Katini Raya No. 26,Kartini,Sawah Besar
20107424,SMK Karya Bahari,B,Jl. Mindi No. 36,Lagoa,K o j a
20109490,SMK Karya Dharma 2 Jakarta,A,"Jl. Raya Bogor Km.28, Gandaria III",Pekayon,Pasar Rebo
20107267,SMK Karya EKOPIN,B,Jl. Raya Pulogebang No. 25,Pulo Gebang,Cakung
20102640,SMK Karya Guna Jakarta,A,Jl. Manggarai Utara 1,Manggarai,T e b e t
20102653,SMK Karya Teladan,B,Jl. Raya Pasar Minggu No. 65,Duren Tiga,Pancoran
20103717,SMK Karya Wijaya Kusuma,B,Jl. Mujahidin No. 17A Tanah Merdeka,Rambutan,Ciracas
20107425,SMK Kasih Ananda,A,Jl. Pegangsaan Dua,Pegangsaan Dua,Kelapa Gading
20100110,SMK Katolik Sint Joseph Jakarta,B,Jl. Kramat Raya No. 134,Kenari,S e n e n
20103793,SMK Kawula Indonesia Jakarta,A,Jl. Raya SMA Kapin No. 3,Pondok Kelapa,Duren Sawit
69758983,SMK Kawula Jakarta,B,Jl Bungur No.29,Rambutan,Ciracas
20101644,SMK Kebon Jeruk Jakarta,B,Jl. Ayub Dalam No. 26 B,Sukabumi Utara,Kebon Jeruk
20101645,SMK Kebudayaan,B,Jl. Semanan Raya Kp. Tanah Tinggi No. 90,Semanan,Kalideres
20107354,SMK Keluarga Widuri,A,Jl. Gunung Balong I,Lebak Bulus,Cilandak
20102652,SMK Kemala Bhayangkari,A,Jl. Ampera Raya Komplek POLRI,Ragunan,Pasar Minggu
20103770,SMK Kemala Bhayangkari 1 Jakarta,A,Jl. Raya Bekasi Timur,Cipinang,Pulo Gadung
20107426,SMK Kencana 1 Jakarta,A,Jl. Raya Sungai Bambu Pool 13A,Sungai Bambu,Tanjung Priok
20107427,SMK Kencana 2 Jakarta,A,Jl. Sungai Bambu Pool 13 A,Sungai Bambu,Tanjung Priok
20101656,SMK Kesatuan,A,Jl. Kesatuan No.1 kp.Klingkit,Rawa Buaya,Cengkareng
20108511,SMK Kesdam Jaya,A,Jl. Kramat Raya No. 174,Kenari,S e n e n
69774854,SMK Kesehatan Gapura Merah Putih,B,Jl. Raya Jagakarsa No. 20,Ciganjur,Jagakarsa
69761954,SMK Kesehatan Global Cendekia,Tidak Terakreditasi,Jl. Gadang No.83 - 85,Tanjung Priok,Tanjung Priok
20109459,SMK Kesehatan Mulia Karya Husada,B,Jl. M. Kahfi II Gang Mesjid An-Nur,Srengseng Sawah,Jagakarsa
69787516,SMK Kesehatan Sekawan,Tidak Terakreditasi,Jl. Kemandoran I,Grogol Utara,Kebayoran Lama
69762614,SMK KESEHATAN TERPADU AR RAISIYAH HUSADA,Tidak Terakreditasi,Jl. Al Baidlo Raya No. 29,Lubang Buaya,Cipayung
20102651,SMK Kharismawita 1 Jakarta,A,Jl. Swadaya II/30,Tanjung Barat,Jagakarsa
20102650,SMK Kharismawita 2,A,Jl. Swadaya II/30,Tanjung Barat,Jagakarsa
20103768,SMK Kimia Tunas Harapan,A,Jl. Bendera Raya / Intisari III No.17,Kalisari,Pasar Rebo
20103767,SMK KRAMAT JATI,B,Jl.Dukuh V No.1A,Dukuh,Kramat Jati
20107355,SMK Krisanti Jakarta,B,Jl. Kampung Melayu Kecil V/22,Bukit Duri,T e b e t
20104458,SMK Kristen Cendrawasih,B,"Jl. Cendrawasih Raya No. 60 Cengkareng, Cengkareng",Cengkareng Barat,Cengkareng
20177909,SMK Kristen Kanaan,Tidak Terakreditasi,Jl. Kran Raya No. 7,Gunung Sahari Selatan,Kemayoran
20100113,SMK Kristen Ketapang,A,Jl. KH. Zainul Arifin No.9,Petojo Utara,Gambir
20107429,SMK Kristen Nazaret,B,Jl. Jembatan II Blok H/29,Pejagalan,Penjaringan
20100114,SMK Ksatrya Jakarta,A,Jl. Percetakan Negara D232,Cempaka Putih Timur,Cempaka Putih
20177921,SMK Laboratorium,C,Jl. Rawa Jaya No.37 Pondok Kopi,Pondok Kopi,Duren Sawit
20107430,SMK Lagoa,B,Jl. Lagoa III No. 135,Lagoa,K o j a
20101649,SMK Lamaholot Jakarta,B,"Jl. Manggis Raya Bojong Indah, Rawabuaya",Rawa Buaya,Cengkareng
20102647,SMK Lebak Bulus Jakarta,A,Jl. Pasar Jumat,Lebak Bulus,Cilandak
20102645,SMK LP 3 Istana,B,Jl. Margasatwa No. 12,Pondok Labu,Cilandak
20103765,SMK L'Pina Jakarta,A,Jl. Raya Bekasi Timur Km. 14.8 No. 5,Jatinegara Kaum,Pulo Gadung
20101648,SMK Ma'arif Jakarta,B,Jl. Dr. Muwardi Raya No. 19,Grogol,Grogol Petamburan
20103764,SMK Mahadhika 1,A,Jl.Raya Centex No. 29-31,Ciracas,Ciracas
20103763,SMK Mahadhika 2,A,Jl. Penggilingan Baru I No.39,Dukuh,Kramat Jati
20103761,SMK Mahadhika 3,A,Jl.Manunggal II,Ciracas,Ciracas
20177896,SMK Mahadhika 4,B,Jl. Raya Bogor Km. 25,Cijantung,Pasar Rebo
20102644,SMK Makarya 1 Jakarta,A,Jl. Pondok Pinang Timur No. 4,Pondok Pinang,Kebayoran Lama
20102643,SMK Makarya 2 Jakarta,A,"Jl. Harun No. 13A, Tanah Kusir",Kebayoran Lama Selatan,Kebayoran Lama
20103760,SMK Malaka Jakarta,A,Jl. Raya Mawar Merah No. 23,Pondok Kopi,Duren Sawit
20177895,SMK Mandala Tiara Bangsa,B,Jl. Rawamangun Muka Selatan,Rawamangun,Pulo Gadung
20103759,SMK Mardhika,B,Jl. Raya Condet No.63,Cililitan,Kramat Jati
20103758,SMK Mardi Bakti Jakarta,B,Jl. Raya Bogor Km. 24,Cijantung,Pasar Rebo
20107357,SMK Media Informatika,A,Jl. Kostrad Raya No. 2,Petukangan Utara,Pesanggrahan
69758520,SMK Medical High School,B,Jl. Raya Munjul No. 2,Munjul,Cipayung
20103756,SMK Mercusuar,A,Jl. Raya Bks Km.26 No.51,Ujung Menteng,Cakung
20102623,SMK Miftahul Falah Jakarta,B,Jl. Almubarok 2,Cipulir,Kebayoran Lama
20103772,SMK Mitra Kencana,B,Jl. Mawar Merah Raya No. 1,Malaka Jaya,Duren Sawit
20102606,SMK Mitra Pembangunan,B,Jl. Benda No. 31 Pedurenan,Cilandak Timur,Pasar Minggu
20112507,SMK Mitra Wisata,B,Jl. Giri Kencana No. 31,Cilangkap,Cipayung
20103774,SMK Muara Indonesia Jakarta,A,Jl. Cipinang Muara III Kav PLN,Cipinang Muara,Jatinegara
20100115,SMK Muhammadiyah 1 Jakarta,A,Jl. Garuda No. 33 Kemayoran,Gunung Sahari Selatan,Kemayoran
20100116,SMK Muhammadiyah 10,B,Jl. Kramat Sawah Baru No. 254,Paseban,S e n e n
20100141,SMK Muhammadiyah 11 Jakarta,B,Jl. Cempaka Wangi II/12,Harapan Mulia,Kemayoran
20107431,SMK Muhammadiyah 12,B,Jl. Haji Murtado No. 2a,Tugu Utara,K o j a
20101632,SMK Muhammadiyah 13 Jakarta,B,Jl. Beringin Raya No. 36-37,Cengkareng Barat,Cengkareng
20109252,SMK Muhammadiyah 15,B,Jl. Karet Belakang raya no.4,Karet Kuningan,Setia Budi
20100142,SMK Muhammadiyah 2 Jakarta,B,Jl. KH. Mas Mansyur No. 65,Kebon Melati,Tanah Abang
20101521,SMK Muhammadiyah 3 Jakarta,A,Jl. Gelong Baru No. 23 A,Tomang,Grogol Petamburan
20101506,SMK Muhammadiyah 4 Jakarta,A,Jl. Anggrek Neli Murni Blok B - C,Kemanggisan,Palmerah
20108509,SMK Muhammadiyah 5 Jakarta (Aisiyah),A,Jl. Taman Bendungan Jatiluhur 18,Bendungan Hilir,Tanah Abang
20103792,SMK Muhammadiyah 6,A,Jl. KH. Ahmad Dahlan No. 20,Kayu Manis,Matraman
20102604,SMK Muhammadiyah 7 Jakarta,A,Jl. Tebet Timur Raya No. 565,Tebet Timur,T e b e t
20102605,SMK Muhammadiyah 9,A,Jl. Panjang Cipulir,Cipulir,Kebayoran Lama
20109907,SMK Multi Media Mandiri,A,Jl. Raya Kedoya Al Kamal No. 2 Kebon Jeruk,Kedoya Selatan,Kebon Jeruk
69774850,SMK Multimedia Nusantara Jakarta,B,Cipinang Besar No. 2,Cipinang Besar Selatan,Jatinegara
20107257,SMK Musik Perg. Cikini,A,Jl. Duren Tiga Raya No.1,Duren Tiga,Pancoran
20107432,SMK Mutiara 1 Jakarta,B,Jl. Komp Yos Sudarso II/19,Kebon Bawang,Tanjung Priok
20101505,SMK Mutiara Bangsa,A,Jl. Utama Raya No. 2,Cengkareng Barat,Cengkareng
20109617,SMK Mutiara Bangsa Tiga,B,Jl. Jelambar Barat III No. 5B,Jelambar Baru,Grogol Petamburan
20103776,SMK Nasional,C,Jl. SMEA 6 No. 53,Cawang,Kramat Jati
20103775,SMK Nasional Alfan,C,Jl. Dukuh V No.1A,Dukuh,Kramat Jati
20100143,SMK Negeri 1,A,Jl. Budi Utomo No. 7,Pasar Baru,Sawah Besar
20103791,SMK Negeri 10,A,Jl. SMEA 6 Mayjend Sutoyo,Cawang,Kramat Jati
20101504,SMK Negeri 11,A,Jl. Pinangsia I No. 20,Pinangsia,Taman Sari
20100783,SMK Negeri 12,A,Jl. Kebon Bawang XV,Kebon Bawang,Tanjung Priok
20101503,SMK Negeri 13,A,Jl. Rawa Belong II-E,Palmerah,Palmerah
20100158,SMK Negeri 14,A,Jl. Percetakan Negara II A,Johar Baru,Johar Baru
20102578,SMK Negeri 15,A,Jl. Mataram 1,Selong,Kebayoran Baru
20100159,SMK Negeri 16,A,Jl. Taman Amir Hamzah,Menteng,Menteng
20101502,SMK Negeri 17,A,"Jl. G. Slipi, Slipi",Slipi,Palmerah
20102589,SMK Negeri 18,A,Jln. Ciputat Raya Komp. Bank Mandiri,Pondok Pinang,Kebayoran Lama
20100160,SMK Negeri 19,A,Jl. Danau Limboto No. 11,Bendungan Hilir,Tanah Abang
20100161,SMK Negeri 2,A,Jl. Batu No. 3,Gambir,Gambir
20102587,SMK Negeri 20,A,Jl. Melati No. 24,Cilandak Barat,Cilandak
20100162,SMK Negeri 21,A,Jl. Siaga I Gg. Swadaya III,Kebon Kosong,Kemayoran
20103790,SMK Negeri 22,A,Jl. Raya Condet,Gedong,Pasar Rebo
20107433,SMK Negeri 23,A,Jl. Pademangan III/19,Pademangan Timur,Pademangan
20103788,SMK Negeri 24,A,Jl. Bambu Hitam,Bambu Apus,Cipayung
20102586,SMK Negeri 25,A,Jl. Raya Ragunan Pasar Minggu,Jati Padang,Pasar Minggu
20103787,SMK Negeri 26,A,Jl. Balai Pustaka Baru 1,Rawamangun,Pulo Gadung
20100163,SMK Negeri 27,A,Jl. Dr. Sutomo No. 1,Pasar Baru,Sawah Besar
20102585,SMK Negeri 28,A,Jl. Maritim No. 26,Cilandak Barat,Cilandak
20102602,SMK Negeri 29,A,"Jl. Prof. Jokosutono, SH. No. 1",Petogogan,Kebayoran Baru
20100164,SMK Negeri 3,A,Jl. Garuda No. 63,Gunung Sahari Selatan,Kemayoran
20102582,SMK Negeri 30,A,Jl. Pakubuwono No. 6,Gunung,Kebayoran Baru
20100165,SMK Negeri 31,A,Jl. Kramat Jaya Baru Blok D II,Johar Baru,Johar Baru
20102581,SMK Negeri 32,A,Jl. Tebet Dalam IV No. 1,Tebet Barat,T e b e t
20107434,SMK Negeri 33,A,Jl. Gading Mas Timur 2,Pegangsaan Dua,Kelapa Gading
20100166,SMK Negeri 34,A,Jl. Kramat Raya No. 93 Paseban,Paseban,S e n e n
20101501,SMK Negeri 35,A,Jl. Kerajinan No. 42,Krukut,Taman Sari
20107435,SMK Negeri 36,A,Jl. Baru Kosambi III,Kalibaru,Cilincing
20102601,SMK Negeri 37,A,Jl. Pertanian III,Pasar Minggu,Pasar Minggu
20100167,SMK Negeri 38,A,Jl. Kebon Sirih No. 38,Gambir,Gambir
20100168,SMK Negeri 39,A,Jl. Cempaka Putih Tengah VI No. 2,Cempaka Putih Timur,Cempaka Putih
20107436,SMK Negeri 4,A,Jl. Rorotan Vi No. 1,Rorotan,Cilincing
20103786,SMK Negeri 40,A,Jl. Nanas II Utan Kayu Utara,Utan Kayu Selatan,Matraman
20102580,SMK Negeri 41,A,Jl. Margasatwa Komplek Timah,Pondok Labu,Cilandak
20101500,SMK Negeri 42,A,Jl. Kamal Raya,Cengkareng Timur,Cengkareng
20102600,SMK Negeri 43,A,Jl. Cipulir 1,Cipulir,Kebayoran Lama
20100157,SMK Negeri 44,A,Jl. Harapan Jaya 9/5A,Cempaka Baru,Kemayoran
20101499,SMK Negeri 45,A,Jl. KPBD,Sukabumi Selatan,Kebon Jeruk
20103785,SMK Negeri 46,A,Jl. B7 Cipinang Pulo No.24,Cipinang Besar Utara,Jatinegara
20102599,SMK Negeri 47,A,Jl. Condet Pejaten,Pejaten Barat,Pasar Minggu
20103784,SMK Negeri 48,A,Jl. Raden Inten II No. 3,Klender,Duren Sawit
20107437,SMK Negeri 49,A,Jl. Sarang Bango No. 1,Marunda,Cilincing
20103783,SMK Negeri 5,A,Jl. Pisangan Timur VII,Pisangan Baru,Matraman
20103782,SMK Negeri 50,A,Jl. Cipinang Muara No. 1,Cipinang Muara,Jatinegara
20103781,SMK Negeri 51,A,Jl. SMEA 33 - SMIK,Bambu Apus,Cipayung
20103780,SMK Negeri 52,A,Jl. Taruna Jaya,Cibubur,Ciracas
20101498,SMK Negeri 53,A,Jl. Flamboyan No. 53,Cengkareng Barat,Cengkareng
20100156,SMK Negeri 54,A,Jl. Bendungan Jago No. 53,Serdang,Kemayoran
20107438,SMK Negeri 55,A,Jl. Pademangan Timur VII,Pademangan Timur,Pademangan
20107439,SMK Negeri 56,A,"Jl. Pluit Timur Raya No. 1 Penjaringan, Jak-Utara",Pluit,Penjaringan
20102598,SMK Negeri 57,A,Jl. Taman Margasatwa No. 38 B,Jati Padang,Pasar Minggu
20103779,SMK Negeri 58,A,Jl. SMIK Bambu Apus,Bambu Apus,Cipayung
